"username","date","retweets","favorites","text","geo","mentions","hashtags","id","permalink"
"JessicaBadgley","2017-02-17 15:54","0","0","Wall of Justice #fieldtrip #tour @Illinois State Capitol https://www.instagram.com/p/BQnlTIyh_an/","","@Illinois","#fieldtrip #tour","832619334593765379","https://twitter.com/JessicaBadgley/status/832619334593765379"
"ninamariarec","2017-02-17 04:11","1","1","I'll b in tha studio tonight with my brain and no drug... Wassup @Dreams2Legends","","@Dreams2Legends","","832442200302686208","https://twitter.com/ninamariarec/status/832442200302686208"
"rob_blue","2017-02-17 00:35","0","0","Shes right. By FAR a better option is to just nuzzle up in Putins bosom and suck down that White Russian. Make America Scared Again https://twitter.com/MAKETHEPLEDGE16/status/832387474634764288 ","","","","832388066744664064","https://twitter.com/rob_blue/status/832388066744664064"
"riptalkinsports","2017-02-16 18:05","0","1","ILLEGAL immigration is the problem, dumb asses! Comprende? #Spanish101","","","#Spanish101","832289838376316930","https://twitter.com/riptalkinsports/status/832289838376316930"
"vetbiz","2017-02-15 22:09","0","0","One reason we like working at the VBRC office downtowntrex. This wall. Some days you just need a https://www.instagram.com/p/BQjGne6B_Nd/","","","","831988913573023745","https://twitter.com/vetbiz/status/831988913573023745"
"Nacho171717","2017-02-15 19:17","0","2","Oh I love how my fam in Mexico can't come visit me when the genuinely miss me bf Frump won't let them in #thanksamerica","","","#thanksamerica","831945619455541251","https://twitter.com/Nacho171717/status/831945619455541251"
"CTFrazee","2017-02-15 15:59","0","0","ayeee happy birthday jenny thanks for being super dope enjoy your wild weekend lmao gang @ https://www.instagram.com/p/BQicPniFP_h/","","@","","831895744726581249","https://twitter.com/CTFrazee/status/831895744726581249"
"Bobby_Brown__","2017-02-14 22:45","0","0","Thanks Cawby family!!! Nice Lincoln gang!!! @Bob Rohrman https://www.instagram.com/p/BQgl4ypFkSGmiAgGtpuqIFq94dfIypPgjvtOmE0/ ","","@Bob","","831635473017794560","https://twitter.com/Bobby_Brown__/status/831635473017794560"
"mapesmd","2017-02-14 21:30","0","2","I walked into my classroom after study hall this morning and found this hanging on the wall... https://www.instagram.com/p/BQgdWTvgS0X/","","","","831616687552204800","https://twitter.com/mapesmd/status/831616687552204800"
"Bobby_Brown__","2017-02-13 16:03","0","0","Just a reminder gang!! I got you! I will take care of you https://www.instagram.com/p/BQdTEfTlX-09b4YunnwS3eHG9KOzRGC_m4vVa80/ ","","","","831171879134179328","https://twitter.com/Bobby_Brown__/status/831171879134179328"
"Bobby_Brown__","2017-02-13 15:38","0","0","Thanks again gang!! Awesome Genesis Coupe Vic!! :) be careful with https://www.instagram.com/p/BQdQNFtldjSrx_UuZqaWzWXAbHeCoOsgeP_lI80/ ","","","","831165583966269440","https://twitter.com/Bobby_Brown__/status/831165583966269440"
"rob_blue","2017-02-13 03:41","1","1","if we can come up with 21 billion or even TEN billion for that lame wall, it ought to be spent on our crumbling infrastructure","","","","830985223785607168","https://twitter.com/rob_blue/status/830985223785607168"
"Maudes_Market","2017-02-13 03:28","0","0","He didn't quite know how to get off the wall. @Butterfly House Faust Park https://www.instagram.com/p/BQb8ub3jJK6/","","@Butterfly","","830982067206905859","https://twitter.com/Maudes_Market/status/830982067206905859"
"rob_blue","2017-02-13 03:25","4","12","So maybe instead of a wall, we can work to prevent future #OrovilleDam disasters. Just a thought.","","","#OrovilleDam","830981175300743169","https://twitter.com/rob_blue/status/830981175300743169"
"bbbrian74","2017-02-13 00:44","1","9","why don't u use that sanctuary city money for it idiot. Stop funding this cities who support illegal immigration period. #MAGA","","","#MAGA","830940785726070786","https://twitter.com/bbbrian74/status/830940785726070786"
"CTFrazee","2017-02-12 18:41","0","0","donut gang @Dunkin Donuts https://www.instagram.com/p/BQbAY6jlma2/","","@Dunkin","","830849330118586368","https://twitter.com/CTFrazee/status/830849330118586368"
"mariecarnes","2017-02-12 18:37","0","1","I look at my phone and wonder if a border guard reading it would think my Trump critical tweets are anti America. https://twitter.com/swanksalot/statuses/830843667455864833 ","","","","830848422609551360","https://twitter.com/mariecarnes/status/830848422609551360"
"dbecker725","2017-02-11 22:57","0","0","Part of my Monday muffin crew! Love this gang! @Decatur Family YMCA https://www.instagram.com/p/BQY44Zwgu9D/","","@Decatur","","830551338782162944","https://twitter.com/dbecker725/status/830551338782162944"
"BreakoutFitSTL","2017-02-11 19:46","1","2","Another fun Fight For Air Stairclimb boot camp in the books!! Great job this morning gang!! @ https://www.instagram.com/p/BQYi_n8hGhr/","","@","","830503207172349952","https://twitter.com/BreakoutFitSTL/status/830503207172349952"
"DanLatham128","2017-02-11 17:12","0","0","Here's another boomerang from that trip to Matthiessen State Park with the gang from @Art_of_Chi https://www.instagram.com/p/BQYRdKNhCCx/","","@Art_of_Chi","","830464634142339072","https://twitter.com/DanLatham128/status/830464634142339072"
"Kathetowers","2017-02-11 06:28","0","0","Just a wall like this one #Love #Usa #Mexico @Bucktown, https://www.instagram.com/p/BQXHv9KlH6lgMa5Uf1NDBuPXW6yR-f0WEobbqY0/ ","","@Bucktown","#Love #Usa #Mexico","830302557918658561","https://twitter.com/Kathetowers/status/830302557918658561"
"ayeejuliaaa","2017-02-10 23:45","0","0","@Graffiti Wall https://www.instagram.com/p/BQWWnrMAXUSTH8z5Zn-rSM1n5H5io4THhQsG4I0/ ","","@Graffiti","","830201155649146880","https://twitter.com/ayeejuliaaa/status/830201155649146880"
"pdub78","2017-02-10 01:10","0","0","Coach Dan making lightwork of wall balls today! #crossfit #testyourmettle #merica #fun https://www.instagram.com/p/BQT-i2EhBPY/","","","#crossfit #testyourmettle #merica #fun","829860097933221888","https://twitter.com/pdub78/status/829860097933221888"
"AmazingTRAPier","2017-02-09 23:45","0","0","Everyday I'm creating something new for the youth #bless @Graffiti Wall https://www.instagram.com/p/BQT0yZVARiI/","","@Graffiti","#bless","829838648162000896","https://twitter.com/AmazingTRAPier/status/829838648162000896"
"Kruse_Missile","2017-02-09 23:24","0","0","Saw this on the wall while at Joshua's Parent Teacher Conference tonight with Mrs. Engwall. @ https://www.instagram.com/p/BQTyYTMgZWZ/","","@","","829833348587601921","https://twitter.com/Kruse_Missile/status/829833348587601921"
"3143152531y","2017-02-09 22:37","0","0","Build toll booties on the border of Mexico. Let's make money from the illegals crossing. It will pay for our healthcare.","","","","829821640812949504","https://twitter.com/3143152531y/status/829821640812949504"
"AmazingTRAPier","2017-02-07 20:28","0","1","Moves _unfocused_photography_ @Graffiti Wall https://www.instagram.com/p/BQOUoLTgUAB/","","@Graffiti","","829064240585666564","https://twitter.com/AmazingTRAPier/status/829064240585666564"
"YakBoyFresh","2017-02-07 04:52","1","4","The feeling of the Holy Spirit is better then any drug , any buzz, any high I've ever https://www.instagram.com/p/BQMpkwbgym3/","","","","828828824263655424","https://twitter.com/YakBoyFresh/status/828828824263655424"
"shinobifitness","2017-02-06 19:11","0","2","A little precision wall jump. #shinobifitness, #boxjump, #precision, #americanninjawarrior, https://www.instagram.com/p/BQLnCU5lQUn/","","","#shinobifitness #boxjump #precision #americanninjawarrior","828682512054501376","https://twitter.com/shinobifitness/status/828682512054501376"
"TotalTrafficSTL","2017-02-06 08:12","0","0","Accident in #Wentzville on Mexico Rd east of State Hwy P #STLtraffic http://bit.ly/17hxde2","","","#Wentzville #STLtraffic","828516808122589184","https://twitter.com/TotalTrafficSTL/status/828516808122589184"
"DTTRLLC","2017-02-06 05:46","0","0","@dttrllc put in some #custom work today and helped out @whoiskevinhu with his new wall https://www.instagram.com/p/BQKK-gxl5Oz/","","@dttrllc @whoiskevinhu","#custom","828480070281023489","https://twitter.com/DTTRLLC/status/828480070281023489"
"greenheadfever","2017-02-06 01:47","0","0","Whole gang out for a hike! Beautiful day. #hiking #naturerocks @Cuivre River State Park https://www.instagram.com/p/BQJvmAig3H_/","","@Cuivre","#hiking #naturerocks","828419848778690560","https://twitter.com/greenheadfever/status/828419848778690560"
"havennnnn","2017-02-06 01:21","0","1","I have been waiting over a year to get a picture in front of this wall and the time finally came https://www.instagram.com/p/BQJspSyBSNH/","","","","828413372865536000","https://twitter.com/havennnnn/status/828413372865536000"
"HartsyThaiFood","2017-02-05 03:51","0","0","2017 Curling Gang. @Waltham Curling Club https://www.instagram.com/p/BQHY_juF_1P/","","@Waltham","","828088689532223489","https://twitter.com/HartsyThaiFood/status/828088689532223489"
"laurrrrsnaps","2017-02-04 23:21","0","0","Guess who stars on the new Orange Krush Lobby wall? You guessed it! https://www.instagram.com/p/BQG6GvqDixmX8gdEPoOQMULgKb2pdSoor20OEQ0/ ","","","","828020752729403393","https://twitter.com/laurrrrsnaps/status/828020752729403393"
"ModestDweeb","2017-02-04 21:14","0","0","March to the Arch for immigration and refugees. #nomuslimban https://www.instagram.com/p/BQGrdJhAA7JNiV2Qs1rA-cBN20IqcS_sr_g-rw0/ ","","","#nomuslimban","827988680744828929","https://twitter.com/ModestDweeb/status/827988680744828929"
"BrianLegate","2017-02-04 20:32","0","0","#STL Protest Against Muslim Ban and Immigration Orders #CAIR #lovethyneighbor @Thomas F. https://www.instagram.com/p/BQGmtqplUFs/","","@Thomas","#STL #CAIR #lovethyneighbor","827978114114453509","https://twitter.com/BrianLegate/status/827978114114453509"
"OutlawFitness","2017-02-04 14:11","0","1","These Tribers crushed it! Rowing, wall balls and planking team workout! @Iron Tribe Fitness https://www.instagram.com/p/BQF7ItpgUBm/","","@Iron","","827882287714938881","https://twitter.com/OutlawFitness/status/827882287714938881"
"TheBoeingCenter","2017-02-03 20:50","0","0","The gang's all here @the #MOCC awards ceremony  #supplychain #innovation #monsanto #college https://www.instagram.com/p/BQED9pbDWLU/","","@the","#MOCC #supplychain #innovation #monsanto #college","827620218134478848","https://twitter.com/TheBoeingCenter/status/827620218134478848"
"Charyl78","2017-02-02 16:04","0","0","My wall of love. @Wells Fargo Home Mortgage https://www.instagram.com/p/BQA-eLjAxaL/","","@Wells","","827185927592239105","https://twitter.com/Charyl78/status/827185927592239105"
"mkcroal","2017-02-02 15:17","0","1","The wall outside of the student activities office sure does look a lot better! @Bradley https://www.instagram.com/p/BQA5G89jfld/","","@Bradley","","827174136044724224","https://twitter.com/mkcroal/status/827174136044724224"
"shinobifitness","2017-02-01 19:05","0","0","When your daughter wants to video tape you running the warped wall, even though your right https://www.instagram.com/p/BP-uWoGFM6e/","","","","826869044015935489","https://twitter.com/shinobifitness/status/826869044015935489"
"MusicRecordShop","2017-01-31 21:26","0","1","Love having these wall racks back! @Dotzack- .ZACK https://www.instagram.com/p/BP8ZxW4AKp7/","","@Dotzack","","826542285651320832","https://twitter.com/MusicRecordShop/status/826542285651320832"
"Bobby_Brown__","2017-01-31 21:11","0","0","Look who came by gang!! Thanks Blake!! Nice Mustang my friend!! @ https://www.instagram.com/p/BP8YAyNF01I8eOvdq17CyTa0AM67N6jqKlILAA0/ ","","@","","826538408784830464","https://twitter.com/Bobby_Brown__/status/826538408784830464"
"shinobifitness","2017-01-31 06:18","0","0","4 year old Ella, showing the safe/proper way to come down a 10' warped wall, if you can't make https://www.instagram.com/p/BP6x3FxliBU/","","","","826313783958179840","https://twitter.com/shinobifitness/status/826313783958179840"
"itsaulbeer","2017-01-31 02:58","0","0","Drinking an Urban Gang by @urbanchestnut at @urbanchestnut  http://untp.beer/s/c412022121","","@urbanchestnut @urbanchestnut","","826263257098883073","https://twitter.com/itsaulbeer/status/826263257098883073"
"mgruver","2017-01-30 02:18","2","5","This GRRRL Gang did something pretty powerful yesterday and over 500 https://www.instagram.com/p/BP3xVo7gaikxI-3MrnCg861zXbI-1CJ51BlXj00/ ","","","","825890966859046912","https://twitter.com/mgruver/status/825890966859046912"
"CTFrazee","2017-01-29 23:59","0","0","gang @Doudna Fine Arts Center https://www.instagram.com/p/BP3hmRjlHiM/","","@Doudna","","825855807799644161","https://twitter.com/CTFrazee/status/825855807799644161"
"GoodmanImage","2017-01-29 20:08","0","1","Protest at Lambert International Airport on immigration @Lambert-St. Louis International https://www.instagram.com/p/BP3HK3Pj8Pw/","","@Lambert","","825797681536708609","https://twitter.com/GoodmanImage/status/825797681536708609"
"GoodmanImage","2017-01-29 20:05","0","0","Protest on immigration at Lambert Saint Louis International Airport @Lambert-St. Louis https://www.instagram.com/p/BP3G5IpjDsj/","","@Lambert","","825797092950032384","https://twitter.com/GoodmanImage/status/825797092950032384"
"Peinado_Liz","2017-01-29 19:28","1","3","No ban. No wall. America is home to all! @Lambert-St. Louis International Airport (Official) https://www.instagram.com/p/BP3Csl1htsa/","","@Lambert","","825787845000384513","https://twitter.com/Peinado_Liz/status/825787845000384513"
"OhJuliaAnn","2017-01-28 23:38","0","0","Mirror mirror on the wall, who loves selfies most of all? @Saint Louis Galleria https://www.instagram.com/p/BP06chRgogu/","","@Saint","","825488238278242304","https://twitter.com/OhJuliaAnn/status/825488238278242304"
"MayaValdez1","2017-01-28 04:14","0","0","Make America Drink Again @Bradley University AEPi https://www.instagram.com/p/BPy1OrFBAUPxAgTWau0mj6zSp-SU6cfQFymJkg0/ ","","@Bradley","","825195279628455936","https://twitter.com/MayaValdez1/status/825195279628455936"
"voice_outside","2017-01-28 00:06","0","0","It's about time!!! #criminal #leftisforpassing @voice_outside @R:DIN STUDIO https://www.instagram.com/p/BPyY0q0AXqA/","","@voice_outside @R","#criminal #leftisforpassing","825132812730847232","https://twitter.com/voice_outside/status/825132812730847232"
"ashpilipovich","2017-01-27 20:59","0","0","""take my pic in front of this rustic wall"" - drunk ashlee @The Landing https://www.instagram.com/p/BPyDa7rg0PhKUlx7OznsOln3Ee7xtAYjTsYzjs0/ ","","@The","","825085749619982336","https://twitter.com/ashpilipovich/status/825085749619982336"
"hcurrierphotog","2017-01-27 13:05","0","0","Happy Friday, gang! I've noticed I have some new faces following along, so allow me to introduce https://www.instagram.com/p/BPxNLe7Dj7z/","","","","824966473726775296","https://twitter.com/hcurrierphotog/status/824966473726775296"
"TheRealYG17","2017-01-27 02:41","0","1","My pilot was British. He is clearly taking a job an American can do. We should build a 40,000 foot wall along the Atlantic coastline. #MAGA!","","","#MAGA","824809642299637761","https://twitter.com/TheRealYG17/status/824809642299637761"
"afieldsphoto","2017-01-26 18:45","0","0","Lunch with gang! (@Thainamite in Vincennes, IN) https://www.swarmapp.com/c/0AqtjvfD7Cl","","@Thainamite","","824689700300591104","https://twitter.com/afieldsphoto/status/824689700300591104"
"meethers_","2017-01-26 17:22","0","0","Today's guerrilla art project: ""Self-portrait on mommy & daddy's bedroom wall"" #kids #wallart https://www.instagram.com/p/BPvF3QzgycG/","","","#kids #wallart","824668907726340097","https://twitter.com/meethers_/status/824668907726340097"
"postingexpert","2017-01-26 02:25","0","0","So they blocked Obama's infrastructure spending for eight years just to end up building a wall? https://twitter.com/lisamascaro/status/824397986381832192 ","","","","824443191353049092","https://twitter.com/postingexpert/status/824443191353049092"
"Nacho171717","2017-01-25 17:59","0","0","Hahaha communications blackout for scientist, starting back up the pipeline, and separating a country with a wall... #goodchoiceamerica","","","#goodchoiceamerica","824315663875448833","https://twitter.com/Nacho171717/status/824315663875448833"
"gigi_eileen","2017-01-25 07:25","0","1","You and I are more than friends, we're like a really small gang @Collinsville, Illinois https://www.instagram.com/p/BPrcq3ljE6Q/","","@Collinsville","","824156112333238272","https://twitter.com/gigi_eileen/status/824156112333238272"
"ArchElements","2017-01-24 20:42","0","0","Wall to wall carpet  Designed and fabricated this 15' long run of display racking for carpet https://www.instagram.com/p/BPqTJtrBH3Q/","","","","823994441564200960","https://twitter.com/ArchElements/status/823994441564200960"
"aDDiCiTeD2HeR_","2017-01-24 19:14","0","0","Still the funniest shyt ive ever watched... "" @LoiterrSquad: DRUG BUST https://twitter.com/LoiterSquadVids/status/635921282312241152/video/1 ""","","@LoiterrSquad","","823972350232317952","https://twitter.com/aDDiCiTeD2HeR_/status/823972350232317952"
"jubeikibigami","2017-01-24 05:42","0","0","The Writing Is On The Wall.. #ReadTheSigns #YoureFuckingAwesome #ThisIsYourMoment https://www.instagram.com/p/BPosLJjFjHr/","","","#ReadTheSigns #YoureFuckingAwesome #ThisIsYourMoment","823767998175526915","https://twitter.com/jubeikibigami/status/823767998175526915"
"mariecarnes","2017-01-24 04:16","0","0","Other countries would hit us back if US hits them w/ border tax. Illinois exports billions in goods and commodities. https://www.illinois.gov/dceo/SmallBizAssistance/Export/Pages/State-of-Illinois-Trade-and-Investment-Statistics.aspx ","","","","823746256124203009","https://twitter.com/mariecarnes/status/823746256124203009"
"CandiceDoula","2017-01-24 03:56","0","0","This is the wall in my office. #nevergiveup #doula #staypositive @Candice Ullery - Childbirth https://www.instagram.com/p/BPof_hNAZV4/","","@Candice","#nevergiveup #doula #staypositive","823741201203527680","https://twitter.com/CandiceDoula/status/823741201203527680"
"SamXQuinn","2017-01-23 21:21","0","0","Make America Gay Again #protest #activism #WhyIMarch #WomensMarch #unity https://www.instagram.com/p/BPnyxvVgF_T/","","","#protest #activism #WhyIMarch #WomensMarch #unity","823641774845558784","https://twitter.com/SamXQuinn/status/823641774845558784"
"RichieTheHippie","2017-01-22 02:41","0","0","Gang Rule #1 Dont Tell @City of East Saint Louis https://www.instagram.com/p/BPi1E29lkaO/","","@City","#1","822997575804469249","https://twitter.com/RichieTheHippie/status/822997575804469249"
"silverdeity52","2017-01-21 21:09","0","0","It doesn't take a president to make America great. It takes people like the Griffin family. @ https://www.instagram.com/p/BPin01-A-eh/","","@","","822914033577824258","https://twitter.com/silverdeity52/status/822914033577824258"
"CB_on_the_run","2017-01-21 20:33","0","2","The illusive, wall climbing narwhal. Happy birthday Claire @ https://www.instagram.com/p/BPijtQ3DEwmjkFErmSrB6Jnrfz_dhdkMdYwo7c0/ ","","@","","822904949269000193","https://twitter.com/CB_on_the_run/status/822904949269000193"
"dwntownpiercing","2017-01-21 03:13","0","0","Weight gang @Iron Age Tattoo https://www.instagram.com/p/BPgsvRchA5F/","","@Iron","","822643347173019652","https://twitter.com/dwntownpiercing/status/822643347173019652"
"imabrick_WALL","2017-01-20 22:00","0","1","3 months with my fav @MacMurray College https://www.instagram.com/p/BPgI4xLhnRV3zaj0aso-Fp9UN523NpKu-vcyFU0/ ","","@MacMurray","","822564572800385024","https://twitter.com/imabrick_WALL/status/822564572800385024"
"Bobby_Brown__","2017-01-20 19:47","0","0","Another satisfied customer!!! Thanks gang!! Great Job Chris!! @ https://www.instagram.com/p/BPf5pVHFxO-7leoO2_vGYnxDhxRcNE1ZTwjesM0/ ","","@","","822530984100958208","https://twitter.com/Bobby_Brown__/status/822530984100958208"
"aaronlaxton","2017-01-20 13:10","0","0","On a day like today, you dress like you are going to a funeral. @Criminal Justice Ministry http://ln.is/www.instagram.com/p/3lmkj ","","@Criminal","","822431034092482560","https://twitter.com/aaronlaxton/status/822431034092482560"
