"username","date","retweets","favorites","text","geo","mentions","hashtags","id","permalink"
"LegiScanMI","2017-03-15 00:46","0","0","HB4355 [NEW] Crimes; prostitution; exemption from prosecution of law enforcement officers from criminal prosecuti... http://bitly.com/WgwYeW","","","","841812848753967104","https://twitter.com/LegiScanMI/status/841812848753967104"
"_HolyGrahl","2017-03-15 00:36","0","0","Mirror mirror on the wall, my girl is the most beautiful of them all https://www.instagram.com/p/BRo41N9Bo_Inm3-4f5QxPAmu4KRYqJGslg1wPQ0/ ","","","","841810227083149312","https://twitter.com/_HolyGrahl/status/841810227083149312"
"LegiScanMI","2017-03-14 19:26","0","0","SB0237 [NEW] Education; curriculum; health curriculum; instruction on prescription opioid drug abuse prevention; ... http://bitly.com/YsUGDi","","","","841732229621514240","https://twitter.com/LegiScanMI/status/841732229621514240"
"LegiScanMI","2017-03-14 16:46","0","0","SB0236 [NEW] Health; controlled substances; prescription drug and opioid abuse commission; require to provide rec... http://bitly.com/WjxetD","","","","841692002844573698","https://twitter.com/LegiScanMI/status/841692002844573698"
"DetroitCP","2017-03-14 14:03","2","0","Amber Alert for boy abducted near Michigan-Ohio border http://detne.ws/2mFoOyf","","","","841650924422549504","https://twitter.com/DetroitCP/status/841650924422549504"
"DetroitCP","2017-03-14 12:38","0","0","Ohio AMBER Alert: 10-month-old abducted near the Michigan border http://toplocalnow.com/us/detroit/at/8","","","","841629514698391553","https://twitter.com/DetroitCP/status/841629514698391553"
"DetroitCP","2017-03-14 12:21","0","0","Ohio Amber Alert: 10-month-old boy abducted by father 10 miles south of Michigan border http://toplocalnow.com/us/detroit/at/8","","","","841625239624728577","https://twitter.com/DetroitCP/status/841625239624728577"
"SoaringLedge","2017-03-14 11:10","0","0","Boys on the wall. #topoutclimbing #boulderingwall #boulderinggym #kidsclub #kidsclimbing @ https://www.instagram.com/p/BRncoEslNiw/","","@","#topoutclimbing #boulderingwall #boulderinggym #kidsclub #kidsclimbing","841607468702670851","https://twitter.com/SoaringLedge/status/841607468702670851"
"robertpittsjjr","2017-03-13 18:20","0","1","Two Egg Omelet with Spinach, Criminal Mushrooms Onion and Cheese. Salmon patties courtesy of https://www.instagram.com/p/BRlpBfblzZA/","","","","841353288201170944","https://twitter.com/robertpittsjjr/status/841353288201170944"
"TotalTrafficDET","2017-03-13 17:16","0","0","Accident, right lane blocked in #MonroeCounty on US-23 SB at Cone Rd, stop and go traffic back to Washtenaw--Monroe Cnty Border #traffic","","","#MonroeCounty #traffic","841337209722679297","https://twitter.com/TotalTrafficDET/status/841337209722679297"
"MattIacopelli","2017-03-13 15:10","0","0","This is one of my favorite wood wall signs that I recently created for my home and Etsy Shop, https://www.instagram.com/p/BRlTRzsFRAS/","","","","841305439937691648","https://twitter.com/MattIacopelli/status/841305439937691648"
"Curvily","2017-03-12 21:21","0","1","Kind of loving this random wall of greenery just randomly hanging out in the Detroit airport. https://www.instagram.com/p/BRjY8AWB5ir/","","","","841036401957249024","https://twitter.com/Curvily/status/841036401957249024"
"DetroitCP","2017-03-12 19:27","0","0","What's the distance between Detroit and Mexico City? https://milesreport.com/routes/dtw-mex","","","","841007761525620736","https://twitter.com/DetroitCP/status/841007761525620736"
"Only1ConnieT","2017-03-12 18:04","0","0","When ""Brown Sugar"" gets placed in her new room... and I finally place my wall decal from my https://www.instagram.com/p/BRjCYPvjgQJ/","","","","840986797400313856","https://twitter.com/Only1ConnieT/status/840986797400313856"
"jasoncomedy1","2017-03-12 17:23","0","0","Smoke break about 15 minutes from the Michigan/Canada border. Now 6 hours to Chicago next! https://www.instagram.com/p/BRi9sLsjnGD/","","","","840976486358237185","https://twitter.com/jasoncomedy1/status/840976486358237185"
"BecAnne216","2017-03-12 14:58","0","0","Like an animal I sometimes like watching long shadows on the wall #SleepySunday @Hazel Park, https://www.instagram.com/p/BRitFrLgnU5/","","@Hazel","#SleepySunday","840939976900653056","https://twitter.com/BecAnne216/status/840939976900653056"
"dianaggraham","2017-03-12 03:49","0","0","wild. #Mamun17 lov the gang @Radisson Plaza Hotel at Kalamazoo Center https://www.instagram.com/p/BRhgjWfFU3Je5nQi1uSAzOCxyvFIl-3zI4je3k0/ ","","@Radisson","#Mamun17","840771686987399168","https://twitter.com/dianaggraham/status/840771686987399168"
"Gulopine","2017-03-12 03:09","0","1","Martys peering straight through the fourth wall at you, and his expression is everything.","","","","840761610037792768","https://twitter.com/Gulopine/status/840761610037792768"
"freshnuttz","2017-03-12 01:03","0","0","KNOCKIN OUT POWER AND KNOCKIN TREES ON CARS!!! WIND GANG #detroit #drawing #michigan https://www.instagram.com/p/BRhNi6PFpVl/","","","#detroit #drawing #michigan","840729879712784386","https://twitter.com/freshnuttz/status/840729879712784386"
"m1kesam","2017-03-11 21:48","0","0","Dads birthday with the gang (@Sakura in Grandville, MI) https://www.swarmapp.com/c/9O8nPAiNYuu","","@Sakura","","840680819853266947","https://twitter.com/m1kesam/status/840680819853266947"
"artrapp","2017-03-11 21:05","0","0","The Anthtopocene by Nikki Wall. @Richard App Gallery https://www.instagram.com/p/BRgyUsNha4t/","","@Richard","","840670011819667456","https://twitter.com/artrapp/status/840670011819667456"
"DetroitCP","2017-03-11 16:23","0","0","NEW: Judge blocks Trump immigration order for Syrian family http://on.freep.com/2naEaxI","","","","840598969226944512","https://twitter.com/DetroitCP/status/840598969226944512"
"mrstevetime","2017-03-11 02:36","0","0","This (or at least a version) in a frame on a wall as part of A Shameful Enlightenment opening https://www.instagram.com/p/BRezYY5jP7F/","","","","840390869144489984","https://twitter.com/mrstevetime/status/840390869144489984"
"ArtDanner","2017-03-11 01:53","0","1","Holy shit. That's one hell of a burrito. @Lindo Mexico Restaurante Mexicano https://www.instagram.com/p/BReuhwmA4ek/","","@Lindo","","840380188689104896","https://twitter.com/ArtDanner/status/840380188689104896"
"ArtDanner","2017-03-11 01:43","0","0","My date this evening. @Lindo Mexico Restaurante Mexicano https://www.instagram.com/p/BRetZFAglCg/","","@Lindo","","840377693828984834","https://twitter.com/ArtDanner/status/840377693828984834"
"TotalTrafficDET","2017-03-10 23:04","0","0","Closed due to accident in #InghamCounty on I-96 EB between Ingham--Livingston Cnty Border and Livingston--Ingham Cnty Border #traffic","","","#InghamCounty #traffic","840337506243604480","https://twitter.com/TotalTrafficDET/status/840337506243604480"
"PureFlawlessnes","2017-03-10 23:01","0","0","Just posted a photo @Canada/US Border https://www.instagram.com/p/BRea2pIhQStyySnM_ugZLNLAf-zpkGN2b0ayHY0/ ","","@Canada","","840336924741066752","https://twitter.com/PureFlawlessnes/status/840336924741066752"
"TotalTrafficDET","2017-03-10 22:47","0","0","Accident, left lane blocked in #InghamCounty on I-96 EB near Ingham--Livingston Cnty Border #traffic http://bit.ly/14JZZ7f","","","#InghamCounty #traffic","840333355052863488","https://twitter.com/TotalTrafficDET/status/840333355052863488"
"TotalTrafficDET","2017-03-10 22:36","0","0","Accident in #InghamCounty on I-96 EB near Ingham--Livingston Cnty Border #traffic http://bit.ly/14JZZ7f","","","#InghamCounty #traffic","840330657519788032","https://twitter.com/TotalTrafficDET/status/840330657519788032"
"TotalTrafficDET","2017-03-10 22:06","0","0","Right lane blocked in #InghamCounty on I-96 EB near Ingham--Livingston Cnty Border #traffic http://bit.ly/14JZZ7f","","","#InghamCounty #traffic","840322956496633856","https://twitter.com/TotalTrafficDET/status/840322956496633856"
"SamanthaNikk","2017-03-10 21:24","0","0","Redid my other wall #samanthanikkolerusticdesigns @Samantha https://www.instagram.com/p/BRePtjvjOBaVofCzn22p9UxYHa6SioBg4Y0NqY0/ ","","@Samantha","#samanthanikkolerusticdesigns","840312427602415616","https://twitter.com/SamanthaNikk/status/840312427602415616"
"SamanthaNikk","2017-03-10 21:04","0","0","Almost done with one wall @Samantha Nikkole Rustic Designs https://www.instagram.com/p/BReNZ9hjyjHoyB4-R_2m6Gr2EMrU7Io8ZmBS1c0/ ","","@Samantha","","840307355384438784","https://twitter.com/SamanthaNikk/status/840307355384438784"
"cuteculturechic","2017-03-10 14:12","0","0","Good morning from the US/Canada border #Detroit @DetroitWindsor Tunnel https://www.instagram.com/p/BRdeLbPFvfr/","","@Detroit","#Detroit","840203768566300673","https://twitter.com/cuteculturechic/status/840203768566300673"
"DetroitCP","2017-03-10 09:44","0","0","February marks fewest arrests at border in recent years http://toplocalnow.com/us/detroit/at/4","","","","840136285582852096","https://twitter.com/DetroitCP/status/840136285582852096"
"LegiScanMI","2017-03-10 01:26","0","0","HB4343 [NEW] Criminal procedure; records; child abuse offenders registry; create. Creates new act. http://bitly.com/WxDmi0","","","","840010887956221953","https://twitter.com/LegiScanMI/status/840010887956221953"
"LegiScanMI","2017-03-10 00:16","0","0","SB0005 [Enroll] Criminal procedure; other; certain definitions and requirements for the manner in which data rega... http://bitly.com/XFsCME","","","","839993341978775552","https://twitter.com/LegiScanMI/status/839993341978775552"
"BTG_FAM","2017-03-09 23:44","1","0","Please Go Support Bow Tie Gang's #GncdeXXL on @DatPiff: Premiering March 9th As A Tribute To https://www.instagram.com/p/BRb4yA4hfVS/","","@DatPiff","#GncdeXXL","839985237782286336","https://twitter.com/BTG_FAM/status/839985237782286336"
"DetroitCP","2017-03-09 23:26","0","0","Lowest one-way fare to Mexico City: $422 https://milesreport.com/routes/dtw-mex","","","","839980660622217216","https://twitter.com/DetroitCP/status/839980660622217216"
"KeepYourLipsOn","2017-03-09 21:19","0","0","BackScratcher (I Nearly Toppled Over The Great Wall [Display]) @MJR Troy Grand Digital Cinema 16 https://www.instagram.com/p/BRbqTAolgzp/","","@MJR","","839948686226567169","https://twitter.com/KeepYourLipsOn/status/839948686226567169"
"LegiScanMI","2017-03-09 20:16","0","0","SB0013 [Enroll] Criminal procedure; probation; penalties for probationers who commit technical probation violatio... http://bitly.com/VLyOnO","","","","839932819744894977","https://twitter.com/LegiScanMI/status/839932819744894977"
"LegiScanMI","2017-03-09 18:26","0","0","SB0011 [Enroll] Legislature; other; program for the management and collection of data related to criminal justice... http://bitly.com/XFFd2e","","","","839905243366371333","https://twitter.com/LegiScanMI/status/839905243366371333"
"LegiScanMI","2017-03-09 18:26","0","0","SB0023 [Enroll] Criminal procedure; other; swift and sure probation sanctions; modify, and create the swift and s... http://bitly.com/XFAQEs","","","","839905207123382272","https://twitter.com/LegiScanMI/status/839905207123382272"
"StarsStripesCF","2017-03-09 17:43","0","0","Wall Ball and Burpees...ugh... #nopower #windless #burpeesforlife #wallballs #sscftrained https://www.instagram.com/p/BRbRmpqgJ6o/","","","#nopower #windless #burpeesforlife #wallballs #sscftrained","839894373848477699","https://twitter.com/StarsStripesCF/status/839894373848477699"
"JohnnyNovak","2017-03-09 17:38","0","0","Remember that one time when I ran a motorcycle gang in Sarnia? #ThrowbackThursday @Sarnia, Ontario https://www.instagram.com/p/BRbRA6Mj5fV/","","@Sarnia","#ThrowbackThursday","839893079851151361","https://twitter.com/JohnnyNovak/status/839893079851151361"
"LegiScanMI","2017-03-09 17:36","0","0","SB0015 [Enroll] Criminal procedure; probation; reduction of term of probation; allow in certain cases. Amends sec... http://bitly.com/VLG4Qu","","","","839892692465299456","https://twitter.com/LegiScanMI/status/839892692465299456"
"dominicnanni","2017-03-09 16:08","0","0","Returning to Mexico City after five years! Grateful for all the opportunities Dr. Lean has given https://www.instagram.com/p/BRbGyXzjrX5/","","","","839870589212966912","https://twitter.com/dominicnanni/status/839870589212966912"
"gaslighters2017","2017-03-09 13:05","0","1","@POTUS Waiting for Graham to expose your blatant lie about wiretaps! Like the lie about wall has Mexico sent check! Americas LIAR IN CHIEF!","","@POTUS","","839824531267207168","https://twitter.com/gaslighters2017/status/839824531267207168"
"LadyLenaOnAir","2017-03-09 03:40","0","0","It's #WORKINGWOMENWEDNESDAY LIVE on @hiphopdetroit with djbj3525 | snatch.gang is in the https://www.instagram.com/p/BRZxFoZlCCP/","","@hiphopdetroit","#WORKINGWOMENWEDNESDAY","839682245967380481","https://twitter.com/LadyLenaOnAir/status/839682245967380481"
"cyborwhat","2017-03-09 03:36","0","0","""Alice in wonderland"" samsung phone cases, laptop sleeves and wall clocks  https://www.instagram.com/p/BRZwpS6hB72/","","","","839681164453404673","https://twitter.com/cyborwhat/status/839681164453404673"
"MikeAgMe","2017-03-09 02:09","0","1","Soy un niggy del Bronx #mikeagme #youtuber #bronx #rap #badfella #mexico #like4like eminem @8 Mile https://www.instagram.com/p/BRZmwpzBraH/","","@8","#mikeagme #youtuber #bronx #rap #badfella #mexico #like4like","839659440445902848","https://twitter.com/MikeAgMe/status/839659440445902848"
"LegiScanMI","2017-03-09 00:36","0","0","HB4333 [NEW] Criminal procedure; sentencing guidelines; sentencing guidelines for crimes of animal cruelty; enact... http://bitly.com/WzbaLH","","","","839635951626379265","https://twitter.com/LegiScanMI/status/839635951626379265"
"LegiScanMI","2017-03-08 19:36","0","0","SB0220 [NEW] Criminal procedure; sentencing guidelines; sentencing guidelines for certain repeat drug offenses; a... http://bitly.com/YpHU8E","","","","839560419622670336","https://twitter.com/LegiScanMI/status/839560419622670336"
"jimbell98","2017-03-08 16:09","0","2","#ironic #letsgo It's really windy up here! @Canada/US Border https://www.instagram.com/p/BRYiGfHAKJBwhp0xLooVxJq2Z7zaK2QqVww6I80/ ","","@Canada","#ironic #letsgo","839508442863775744","https://twitter.com/jimbell98/status/839508442863775744"
"Mike0686","2017-03-08 15:23","0","0","My first shinola swag. Next, watch or wall clock? @The M@dison Building https://www.instagram.com/p/BRYc2qeAj5x/","","@The @dison","","839496900919324674","https://twitter.com/Mike0686/status/839496900919324674"
"jroadchurch","2017-03-08 15:18","0","0","#Repost @tcmooney  After 3 days, we have a whole new look for the Every 12th wall! @Jericho https://www.instagram.com/p/BRYcQzIDVsk/","","@tcmooney @Jericho","#Repost","839495605143625729","https://twitter.com/jroadchurch/status/839495605143625729"
"TCMooney","2017-03-08 15:14","0","0","After 3 days, we have a whole new look for the Every 12th wall! @ https://www.instagram.com/p/BRYb0Y1BwgQIeDZ4fp4fT0AlE_FMHYDS6_k32M0/ ","","@","","839494626780168192","https://twitter.com/TCMooney/status/839494626780168192"
"shoppingtutor","2017-03-08 15:07","0","0","Find your tiny clear wall vase on @etsy as they have LARGE selection, then buy cute wildflowers https://www.instagram.com/p/BRYa_UvhnJi/","","@etsy","","839492803600121857","https://twitter.com/shoppingtutor/status/839492803600121857"
"Mirandykay","2017-03-08 04:03","0","1","This wall reminds me of places I'd like to be right about now #downtown #detroit #michigan  https://www.instagram.com/p/BRXO2iFAGTN/","","","#downtown #detroit #michigan","839325667124740101","https://twitter.com/Mirandykay/status/839325667124740101"
"jjaaoying","2017-03-07 22:48","0","0","I'm at Lindo Mexico Restaurant in Wyoming, MI https://www.swarmapp.com/c/0SkOmEmX14v","","","","839246397744496640","https://twitter.com/jjaaoying/status/839246397744496640"
"DetroitCP","2017-03-07 13:34","0","0","Ben Carson compares slavery to immigration to America http://dlvr.it/NYq2rJ","","","","839106919046369281","https://twitter.com/DetroitCP/status/839106919046369281"
"DetroitCP","2017-03-07 13:34","0","0","Ben Carson compares slavery to immigration to America http://toplocalnow.com/us/detroit/at/8","","","","839106907180683264","https://twitter.com/DetroitCP/status/839106907180683264"
"scottrheath","2017-03-07 02:01","0","0","#Superman lets #trump know what he thinks of his f*cking #Wall! #DCComics #Trump #EmperorTrump http://ln.is/www.instagram.com/p/DPq4I ","","","#Superman #trump #Wall #DCComics #Trump #EmperorTrump","838932577763360768","https://twitter.com/scottrheath/status/838932577763360768"
"DetroitCP","2017-03-06 23:42","0","0","Carson compares slavery to immigration to America http://toplocalnow.com/us/detroit/at/18 ","","","","838897521996902400","https://twitter.com/DetroitCP/status/838897521996902400"
"DetroitCP","2017-03-06 22:12","0","0","Migrant labor shortages have already hit Michigan farms. Donald J. Trump's immigration plan could make it worse https://twitter.com/i/web/status/838860490973532161 ","","","","838874882121203712","https://twitter.com/DetroitCP/status/838874882121203712"
"emmadavidsonpho","2017-03-06 21:42","0","1","Over the last few weeks I've been working alongside Border City Living by taking photos for this https://www.instagram.com/p/BRT-llOFDcy/","","","","838867402100178944","https://twitter.com/emmadavidsonpho/status/838867402100178944"
"Spazoutink","2017-03-06 18:34","0","0","I got to sign the wall of fame at eternalink today with a bunch of legends in the tattoo https://www.instagram.com/p/BRTpEgkgI-g/","","","","838820077176819714","https://twitter.com/Spazoutink/status/838820077176819714"
"megan_prawdzik","2017-03-06 17:37","0","0","Not in Mexico @Lake Orion, Michigan https://www.instagram.com/p/BRTih5xlC6D/","","@Lake","","838805701157867520","https://twitter.com/megan_prawdzik/status/838805701157867520"
"DetroitCP","2017-03-06 16:27","0","0","New owners of Houston home find human remains in wall http://detne.ws/2n65oBy","","","","838788056287072257","https://twitter.com/DetroitCP/status/838788056287072257"
"valkolton","2017-03-05 21:58","0","2","Head-Fi HQ wall in Detroit!!! So good to see Jude and introduce new @VMODA speaker and in ear https://www.instagram.com/p/BRRbpK3gfGG/","","@VMODA","","838509075533025280","https://twitter.com/valkolton/status/838509075533025280"
"KevinBuford","2017-03-05 03:13","0","2","B.A.N.G BTS w/ iamt_bridges & Gang #kzoo #BANG #LRP #bts #fun #production #shoot #photoshoot https://www.instagram.com/p/BRPa4n6DDAw/","","","#kzoo #BANG #LRP #bts #fun #production #shoot #photoshoot","838225937858719747","https://twitter.com/KevinBuford/status/838225937858719747"
"DetroitCP","2017-03-04 23:57","0","0","On Michigan farms & in restaurants, who will fill jobs? Immigration crackdowns could scare away seasonal workers http://toplocalnow.com/us/detroit/at/18 ","","","","838176537362882560","https://twitter.com/DetroitCP/status/838176537362882560"
"happytailsrule","2017-03-04 22:24","0","0","Rossi graduated from Puppy Preschool today! His dad complimented a bulldog picture on the wall https://www.instagram.com/p/BRO5yVxBSFd/","","","","838153148548050944","https://twitter.com/happytailsrule/status/838153148548050944"
"AEtherZcythe","2017-03-04 18:37","0","0","#NowPlaying: Another Brick In the Wall Part 2 (House Remix) (Cover Version) - Fee Waybill (of The Tubes) & Ronnie Montrose (o... #iSmoothRun","","","#NowPlaying #iSmoothRun","838096038711930881","https://twitter.com/AEtherZcythe/status/838096038711930881"
"SoaringLedge","2017-03-04 17:27","0","0","Foosball and climbing wall @soaringledge #foosball #foosballtable #morefun @Soaring Ledge https://www.instagram.com/p/BROX2kYl63Q/","","@soaringledge @Soaring","#foosball #foosballtable #morefun","838078533171806209","https://twitter.com/SoaringLedge/status/838078533171806209"
"mrstevetime","2017-03-04 13:13","0","0","Sometimes, we just fix things. This goes back on a wall in an exhibit this morning. Less than 24 https://www.instagram.com/p/BRN6xIXjOR2/","","","","838014567817097216","https://twitter.com/mrstevetime/status/838014567817097216"
"DetroitCP","2017-03-04 12:21","0","0","Mexico mum on how border wall could influence NAFTA talks http://toplocalnow.com/us/detroit/at/7","","","","838001369525071873","https://twitter.com/DetroitCP/status/838001369525071873"
"DetroitCP","2017-03-04 10:21","0","0","Editorial: Commit to real immigration reform via Detroit News Opinion http://toplocalnow.com/us/detroit/at/5","","","","837971191428087808","https://twitter.com/DetroitCP/status/837971191428087808"
"DetroitCP","2017-03-03 23:27","0","0","What's the distance between Detroit and Mexico City? https://milesreport.com/routes/dtw-mex","","","","837806617571663872","https://twitter.com/DetroitCP/status/837806617571663872"
"TotalTrafficDET","2017-03-03 20:57","0","0","Accident, left lane blocked in #InghamCounty on I-96 EB before Ingham--Livingston Cnty Border #traffic http://bit.ly/14JZZ7f","","","#InghamCounty #traffic","837768996355211264","https://twitter.com/TotalTrafficDET/status/837768996355211264"
"TotalTrafficDET","2017-03-03 20:56","0","0","I-96 eb at m-52 accident left lane blocked. in #InghamCounty on I-96 EB at Ingham--Livingston Cnty Border #traffic http://bit.ly/14JZZ7f","","","#InghamCounty #traffic","837768767203643392","https://twitter.com/TotalTrafficDET/status/837768767203643392"
"TotalTrafficDET","2017-03-03 20:14","0","0","Accident cleared in #Ingham on I-96 EB before Ingham--Livingston Cnty Border #traffic http://bit.ly/14JZZ7f","","","#Ingham #traffic","837758100165775362","https://twitter.com/TotalTrafficDET/status/837758100165775362"
"CortriceB","2017-03-03 19:16","0","0","Who about to graduate after a gang of years.......Me dats who!!! Yayyyy zurlontipton37 look https://www.instagram.com/p/BRL_go9ApZF/","","","","837743526498746368","https://twitter.com/CortriceB/status/837743526498746368"
"TotalTrafficDET","2017-03-03 19:01","0","1","I-96 eb at williamston rd. exit 117-a. an accident. caution advised. in #Ingham on I-96 EB before Ingham--Livingston Cnty Border #traffic","","","#Ingham #traffic","837739603922649089","https://twitter.com/TotalTrafficDET/status/837739603922649089"
"DetroitCP","2017-03-03 17:51","0","0","Canton HS assistant coach charged with criminal sexual conduct http://dlvr.it/NXBLHw","","","","837722015062642688","https://twitter.com/DetroitCP/status/837722015062642688"
"LegiScanMI","2017-03-03 03:36","0","0","HB4304 [NEW] Criminal procedure; sentencing guidelines; sentencing guidelines for crime of assaulting or obstruct... http://bitly.com/WlLou6","","","","837506890653388800","https://twitter.com/LegiScanMI/status/837506890653388800"
"mrstevetime","2017-03-03 03:21","0","0","We were in Mexico. Now we are in Dearborn. #fatherandson #thefinnandi #mexico https://www.instagram.com/p/BRKSP4JDkjS/","","","#fatherandson #thefinnandi #mexico","837503254950969344","https://twitter.com/mrstevetime/status/837503254950969344"
"LegiScanMI","2017-03-03 02:46","0","0","HB4299 [NEW] Criminal procedure; evidence; consideration of videorecorded statements in certain proceedings; allo... http://bitly.com/YCD8ER","","","","837494372048515072","https://twitter.com/LegiScanMI/status/837494372048515072"
"LegiScanMI","2017-03-03 02:36","0","0","HB4296 [NEW] Criminal procedure; sentencing guidelines; sentencing guidelines for willfully failing to collect or... http://bitly.com/WlBEAh","","","","837491897534922753","https://twitter.com/LegiScanMI/status/837491897534922753"
"LegiScanMI","2017-03-02 23:36","0","0","HB4297 [NEW] Criminal procedure; evidence; presumption that certain documents affecting real property are forged ... http://bitly.com/YID2vj","","","","837446544349626368","https://twitter.com/LegiScanMI/status/837446544349626368"
"luvcherripye","2017-03-02 18:22","0","0","Ran to the border. Just download the APP! #TacoBell (@Taco Bell in Rochester Hills, MI) https://www.swarmapp.com/c/hrODZanaWZV pic.twitter.com/BUwiAc8TUJ","","@Taco","#TacoBell","837367462115037184","https://twitter.com/luvcherripye/status/837367462115037184"
"BenRosenzweig","2017-03-01 22:31","0","0","If you have a beautiful historic tile wall and there is a problem - any problem. The right way https://www.instagram.com/p/BRHMOIoAaSY/","","","","837067787151491072","https://twitter.com/BenRosenzweig/status/837067787151491072"
"DetroitCP","2017-03-01 21:31","0","0","Ann Arbor father of 4 with a criminal history has been spared from deportation http://detne.ws/2m4vAPZ","","","","837052654375194624","https://twitter.com/DetroitCP/status/837052654375194624"
"LegiScanMI","2017-03-01 19:06","0","1","SB0205 [NEW] Criminal procedure; sentencing guidelines; guidelines for violation of the lawful internet gaming ac... http://bitly.com/Wvl8gZ","","","","837016154593968129","https://twitter.com/LegiScanMI/status/837016154593968129"
"ShaunisDope","2017-03-01 17:00","0","1","Free pizza gang @Pieology Pizzeria https://www.instagram.com/p/BRGmYr5lSrS/","","@Pieology","","836984591445540865","https://twitter.com/ShaunisDope/status/836984591445540865"
"gaslighters2017","2017-03-01 14:04","0","0","It is funny that to the GOP infrastructure sounds good Obama proposed it for 8yrs to a ""WALL"" of obstruction! What a bunch of hypocrites!","","","","836940280515428352","https://twitter.com/gaslighters2017/status/836940280515428352"
"LegiScanMI","2017-03-01 04:07","0","0","HB4284 [NEW] Health; pharmaceuticals; prescription drug monitoring system of controlled substances; require depar... http://bitly.com/WsjUDc","","","","836789874799886336","https://twitter.com/LegiScanMI/status/836789874799886336"
"mlcpnc1380","2017-03-01 00:25","0","0","I'm at Goodrich W. Columbia 7 - @gqti for The Great Wall in Battle Creek, MI https://www.swarmapp.com/c/3lhrgM43jdm","","@gqti","","836733997984202752","https://twitter.com/mlcpnc1380/status/836733997984202752"
