"username","date","retweets","favorites","text","geo","mentions","hashtags","id","permalink"
"mrstevetime","2017-02-11 23:31","0","0","Chorizo tacos. In one week we'll be eating them in Mexico. #fatherandson #thefinnandi https://www.instagram.com/p/BQY8xuVB6Yp/","","","#fatherandson #thefinnandi","830559902581940225","https://twitter.com/mrstevetime/status/830559902581940225"
"theladysteffi","2017-02-11 23:29","0","0","This is how you ""Make America Great Again"" #SquatterAdministration and you've at least got the https://www.instagram.com/p/BQY8kyCA8ka/","","","#SquatterAdministration","830559454588440578","https://twitter.com/theladysteffi/status/830559454588440578"
"DetroitCP","2017-02-11 20:45","0","0","Windsor Public Schools cancel all U.S. field trips until clearer immigration decision is made http://bit.ly/2ki3Oe5","","","","830518037358862336","https://twitter.com/DetroitCP/status/830518037358862336"
"peterhoneyman","2017-02-11 16:48","0","5","at last? Deportations way up under Obama. You appear to be poorly informed about enforcement of immigration laws.","","","","830458544394747904","https://twitter.com/peterhoneyman/status/830458544394747904"
"davidgrierson70","2017-02-11 15:00","0","0","The Crazy Gang in good spirits! #squirrels #crazygang #annarbor #Michigan @Downtown Ann Arbor, https://www.instagram.com/p/BQYCUOSgKjQ/","","@Downtown","#squirrels #crazygang #annarbor #Michigan","830431343620259840","https://twitter.com/davidgrierson70/status/830431343620259840"
"pawlanta","2017-02-11 13:47","0","2","Wall sits ... Doing work! (at @PlanetFitness in Grand Rapids, MI) https://www.swarmapp.com/c/lkqeCzCVk4H pic.twitter.com/etiAUOA0vt","","@PlanetFitness","","830412890880499713","https://twitter.com/pawlanta/status/830412890880499713"
"DetroitCP","2017-02-11 13:21","0","0","Mike Ilitch legacy wall: Share your memories and condolences http://toplocalnow.com/us/detroit","","","","830406421187473408","https://twitter.com/DetroitCP/status/830406421187473408"
"DaveBelknap","2017-02-11 11:39","0","0","My Daughter, ever photogenic @Lindo Mexico Restaurante Mexicano https://www.instagram.com/p/BQXrR47A56t/","","@Lindo","","830380684686548992","https://twitter.com/DaveBelknap/status/830380684686548992"
"sarcrane","2017-02-11 01:29","0","0","Obsessed with this wall, this woman, and Fridays. Happy weekend, friends! @Grand Rapids, https://www.instagram.com/p/BQWleTZFcwI/","","@Grand","","830227185625612289","https://twitter.com/sarcrane/status/830227185625612289"
"Kylo_Ren__","2017-02-11 01:07","0","0","Come at me, nigga and u will see...i ain't nobody to play wit. Got a gang a niggas all over, so if i don't catch one of them will","","","","830221733412089856","https://twitter.com/Kylo_Ren__/status/830221733412089856"
"gimmemoreacker","2017-02-10 23:55","0","0","I'm at Mexico Lindo in Waterford, MI https://www.swarmapp.com/c/3SYb24V0cGU","","","","830203544473071616","https://twitter.com/gimmemoreacker/status/830203544473071616"
"LegiScanMI","2017-02-10 19:06","0","0","HB4190 [NEW] Criminal procedure; evidence; admissibility of prior acts of sexual crimes; allow under certain circ... http://bitly.com/WmXa7E","","","","830130965158694912","https://twitter.com/LegiScanMI/status/830130965158694912"
"HiddenLLC","2017-02-10 17:03","0","0","49 inch Toshiba 4K Ultra HD TV with wall mount remote and HDMI cable $300. Located at 2069 golfside Road Ypsilanti Michigan 734 340-5189. pic.twitter.com/AOsDFAQVLl","","","","830099966274260993","https://twitter.com/HiddenLLC/status/830099966274260993"
"DetroitCP","2017-02-10 14:59","0","0","New bill adds incentives for companies along Michigan's border counties http://toplocalnow.com/us/detroit","","","","830068570675490816","https://twitter.com/DetroitCP/status/830068570675490816"
"LegiScanMI","2017-02-10 03:06","0","0","SB0128 [NEW] Criminal procedure; sentencing guidelines; guidelines for crime of targeting law enforcement officer... http://bitly.com/WlKduG","","","","829889157874982914","https://twitter.com/LegiScanMI/status/829889157874982914"
"CurtisWithaC","2017-02-10 00:27","0","0","Less Than Pepper (@The Majestic Theatre - @majesticdetroit for Pepper, Less Than Jake, the Bunny Gang, the Attack) https://www.swarmapp.com/c/4txmHbi54rg","","@The @majesticdetroit","","829849270484344832","https://twitter.com/CurtisWithaC/status/829849270484344832"
"guitarsrock87","2017-02-10 00:06","0","0","I'm at The Majestic Theatre - @majesticdetroit for Pepper, Less Than Jake, the Bunny Gang, the Attack in Detroit, MI https://www.swarmapp.com/c/dLyhyRJ7VJi","","@majesticdetroit","","829844001922629632","https://twitter.com/guitarsrock87/status/829844001922629632"
"bcsocia","2017-02-09 22:03","0","0","Dropping the retaining wall into position. #digging #autoindustry #automotive #work @Sterling https://www.instagram.com/p/BQTpIqPFYc2/","","@Sterling","#digging #autoindustry #automotive #work","829813024349360128","https://twitter.com/bcsocia/status/829813024349360128"
"bcsocia","2017-02-09 22:03","0","0","Retaining wall is already in this pit and ready to start forming and pouring footings. #work https://www.instagram.com/p/BQTpITylPDt/","","","#work","829813014887067649","https://twitter.com/bcsocia/status/829813014887067649"
"bcsocia","2017-02-09 21:56","0","0","Moving some retaining wall into position do digging a VDL pit. #work #automotive #autoindustry https://www.instagram.com/p/BQToRBhF0JF/","","","#work #automotive #autoindustry","829811115232284677","https://twitter.com/bcsocia/status/829811115232284677"
"CaronRiha","2017-02-09 21:30","0","0","Home with a moat, candy wall, James Bond room, for $250m, I'll take it! http://ow.ly/pmcf308P5Y4 pic.twitter.com/Io94xQSuOD","","","","829804678548484096","https://twitter.com/CaronRiha/status/829804678548484096"
"JimmyLe1","2017-02-09 04:06","0","0","Inspiring to hear Gloria Nelund's story today! Gloria spent 30 years on Wall Street as one of https://www.instagram.com/p/BQRt3LBFMPt/","","","","829541943520673793","https://twitter.com/JimmyLe1/status/829541943520673793"
"DetroitCP","2017-02-08 21:29","0","0","Border officers find nearly 2 tons of weed camouflaged as limes http://bit.ly/2lrTa6x","","","","829442090304102400","https://twitter.com/DetroitCP/status/829442090304102400"
"AlbesBMX","2017-02-08 19:51","0","1","Cool photo of Albe's own @tylerfernengel in Aguascalientes, Mexico on the #mexiharo tour with https://www.instagram.com/p/BQQ1OryApvX/","","@tylerfernengel","#mexiharo","829417404052733959","https://twitter.com/AlbesBMX/status/829417404052733959"
"mrstevetime","2017-02-08 14:08","0","0","Soon, Finn. Soon. #fatherandson #thefinnandi #mexico #reachthebeach @Finnished https://www.instagram.com/p/BQQN_q7BHWD/","","@Finnished","#fatherandson #thefinnandi #mexico #reachthebeach","829331125650612226","https://twitter.com/mrstevetime/status/829331125650612226"
"DetroitCP","2017-02-07 10:43","0","0","Bankole Thompson: How immigration could shape governors race http://detne.ws/2kDLZdX","","","","828916991972872194","https://twitter.com/DetroitCP/status/828916991972872194"
"ajsaesthetic","2017-02-06 17:19","0","0","wall + words @Literati Bookstore https://www.instagram.com/p/BQLZXc1D1Bk/","","@Literati","","828654338675458048","https://twitter.com/ajsaesthetic/status/828654338675458048"
"BenMCobb","2017-02-06 03:24","0","0","#led #wall #superbowl #patriots #falcons @livespaceavl best Party of the year @LiveSpace https://www.instagram.com/p/BQJ6p5ags_g/","","@livespaceavl @LiveSpace","#led #wall #superbowl #patriots #falcons","828444172201910272","https://twitter.com/BenMCobb/status/828444172201910272"
"GGPhamousNM","2017-02-05 23:03","0","0","Grind Hard Or Die Starving Pendant ( Design by @GGPhamousNM ) Grind Gang Chains Coming Soon! https://www.instagram.com/p/BQJcy3JjQLs/","","@GGPhamousNM","","828378525690322945","https://twitter.com/GGPhamousNM/status/828378525690322945"
"GGPhamousNM","2017-02-05 22:59","0","0","BullShit $ells Pendant ( Design by @GGPhamousNM ) Grind Gang Chains Coming Soon! #4637GrindGang https://www.instagram.com/p/BQJcWpeDj6s/","","@GGPhamousNM","#4637GrindGang","828377559419191296","https://twitter.com/GGPhamousNM/status/828377559419191296"
"GGPhamousNM","2017-02-05 22:55","0","0","Grind Gang Or No Gang (Dogtag) Pendant ( Design by @GGPhamousNM ) Grind Gang Chains Coming Soon! https://www.instagram.com/p/BQJb8m9jTMH/","","@GGPhamousNM","","828376655894872064","https://twitter.com/GGPhamousNM/status/828376655894872064"
"DetroitCP","2017-02-05 04:47","0","0","DOJ moves to appeal judge's order on immigration ban http://dlvr.it/NHmYJc","","","","828102622661877762","https://twitter.com/DetroitCP/status/828102622661877762"
"Alex_Macken","2017-02-05 00:47","0","0","#HappyBirthdayJenn #WestSideBeerTour #BeerCityUSA - Drinking a Purple Gang Pilsner @Atwater Brewery - http://untp.beer/s/c413789093","","@Atwater","#HappyBirthdayJenn #WestSideBeerTour #BeerCityUSA","828042344473714689","https://twitter.com/Alex_Macken/status/828042344473714689"
"bigtreebbq","2017-02-05 00:08","0","0","On The Border Keto style. Ultimate fajitas with guak and cheese. No tortillas, pico or sour https://www.instagram.com/p/BQG_bzWg6z6/","","","","828032470700417024","https://twitter.com/bigtreebbq/status/828032470700417024"
"GGPhamousNM","2017-02-04 23:52","0","1","Grind Gang Pendant ( Design by @GGPhamousNM ) Grind Gang Chains Coming Soon! #4637GrindGang https://www.instagram.com/p/BQG9o60DOGo/","","@GGPhamousNM","#4637GrindGang","828028541371609088","https://twitter.com/GGPhamousNM/status/828028541371609088"
"Pives","2017-02-04 20:23","0","0","Why build a wall when you can have freezing river in between https://www.instagram.com/p/BQGlrh5ggsCY9X9IiPkROomZ5fG7vvDf9RCprA0/ ","","","","827975836443824128","https://twitter.com/Pives/status/827975836443824128"
"DetroitCP","2017-02-04 19:43","0","0","President Trump immigration ban dismantled by government after court order http://toplocalnow.com/us/detroit","","","","827965863026323456","https://twitter.com/DetroitCP/status/827965863026323456"
"GGPhamousNM","2017-02-04 16:18","0","0","Boosie Bad Azz x Grind Gang (Luey) #legendary #4637GrindGang #BoosieBadAzz #BadAzzEnt https://www.instagram.com/p/BQGJqdyD_ER/","","","#legendary #4637GrindGang #BoosieBadAzz #BadAzzEnt","827914281870041088","https://twitter.com/GGPhamousNM/status/827914281870041088"
"mrstevetime","2017-02-04 13:40","0","0","Soon, Finn. Soon. #fatherandson #thefinnandi #mexico #padreehijo #reachthebeach @Finnished https://www.instagram.com/p/BQF3jZDFjER/","","@Finnished","#fatherandson #thefinnandi #mexico #padreehijo #reachthebeach","827874407112704000","https://twitter.com/mrstevetime/status/827874407112704000"
"timhorvath","2017-02-04 03:20","0","0","I'm at Border Cantina in Novi, MI https://www.swarmapp.com/c/iC75AaDBitG","","","","827718463384911873","https://twitter.com/timhorvath/status/827718463384911873"
"scottrheath","2017-02-04 01:49","0","0","#Trump #Wall @Albion College http://ln.is/www.instagram.com/p/P1TJP ","","@Albion","#Trump #Wall","827695453449895936","https://twitter.com/scottrheath/status/827695453449895936"
"DetroitCP","2017-02-03 13:37","0","0","- Federal judge in Detroit issues order temporarily restraining Trump Administration from carrying out immigration http://toplocalnow.com/us/detroit","","","","827511344849047552","https://twitter.com/DetroitCP/status/827511344849047552"
"DetroitCP","2017-02-03 13:19","0","0","Federal judge in Detroit orders President Trump to halt immigration restrictions http://toplocalnow.com/us/detroit","","","","827506819350228992","https://twitter.com/DetroitCP/status/827506819350228992"
"DetroitCP","2017-02-03 13:19","0","0","Federal judge in Detroit issues order temporarily restraining Trump Administration from carrying out immigration http://toplocalnow.com/us/detroit","","","","827506817697669120","https://twitter.com/DetroitCP/status/827506817697669120"
"DetroitCP","2017-02-03 13:02","0","0","Our most-commented piece this week via Ron Fournier: Trump exec order on immigration an assault on Michigan economy http://toplocalnow.com/us/detroit","","","","827502419302952960","https://twitter.com/DetroitCP/status/827502419302952960"
"LegiScanMI","2017-02-03 05:36","0","0","SB0011 [Engross] Legislature; other; program for the management and collection of data related to criminal justic... http://bitly.com/XFFd2e","","","","827390330039259137","https://twitter.com/LegiScanMI/status/827390330039259137"
"LegiScanMI","2017-02-03 00:46","0","0","SB0013 [Engross] Criminal procedure; probation; penalties for probationers who commit technical probation violati... http://bitly.com/VLyOnO","","","","827317279981465601","https://twitter.com/LegiScanMI/status/827317279981465601"
"LegiScanMI","2017-02-03 00:26","0","0","HB4158 [NEW] Criminal procedure; forfeiture; asset forfeiture; require a criminal conviction before proceeding. A... http://bitly.com/YorKfI","","","","827312375137173504","https://twitter.com/LegiScanMI/status/827312375137173504"
"LegiScanMI","2017-02-02 21:47","0","0","SB0023 [Engross] Criminal procedure; other; swift and sure probation sanctions; modify, and create the swift and ... http://bitly.com/XFAQEs","","","","827272239212949504","https://twitter.com/LegiScanMI/status/827272239212949504"
"LegiScanMI","2017-02-02 21:37","0","0","SB0005 [Engross] Criminal procedure; other; certain definitions and requirements for the manner in which data reg... http://bitly.com/XFsCME","","","","827269778364526593","https://twitter.com/LegiScanMI/status/827269778364526593"
"LegiScanMI","2017-02-02 21:27","0","0","SB0015 [Engross] Criminal procedure; probation; reduction of term of probation; allow in certain cases. Amends se... http://bitly.com/VLG4Qu","","","","827267185378668545","https://twitter.com/LegiScanMI/status/827267185378668545"
"DetroitCP","2017-02-02 21:23","0","0","Ron Fournier : Trump's executive order on immigration is an assault on Michigan's economy http://toplocalnow.com/us/detroit/topics/trump ","","","","827266128481132544","https://twitter.com/DetroitCP/status/827266128481132544"
"mrstevetime","2017-02-02 20:10","0","0","Soon, Finn. Soon. #fatherandson #thefinnandi #mexico #padreehijo #player @Finnished https://www.instagram.com/p/BQBalkghfO-/","","@Finnished","#fatherandson #thefinnandi #mexico #padreehijo #player","827247753906450432","https://twitter.com/mrstevetime/status/827247753906450432"
"Lace_Boutique","2017-02-02 18:16","0","0","Stunning 15x12 wooden wall plaques adorned with Swarovski Crystal! Makes a beautiful gift https://www.instagram.com/p/BQBNiF0Ah0-/","","","","827219049042034689","https://twitter.com/Lace_Boutique/status/827219049042034689"
"Det_Clue","2017-02-02 16:25","0","1","#Repost @dnhnsn  Tonight's the night people! Come celebrate our new wall art by local Detroit https://www.instagram.com/p/BQBA0k3j5gQ/","","@dnhnsn","#Repost","827191096354684930","https://twitter.com/Det_Clue/status/827191096354684930"
"caitlinburt","2017-02-02 16:06","0","0","Gotta go all out @genittis #actor #comedy #princess @Genitti's Hole in the Wall https://www.instagram.com/p/BQA-t7OlOCu/","","@genittis @Genitti","#actor #comedy #princess","827186474432987137","https://twitter.com/caitlinburt/status/827186474432987137"
"simpson_sherri","2017-02-02 15:24","0","0","Keep climbing, your goals are worth it. - - - (This is me climbing an indoor wall that no longer https://www.instagram.com/p/BQA52FnA10v/","","","","827175755872362496","https://twitter.com/simpson_sherri/status/827175755872362496"
"mrstevetime","2017-02-02 14:03","0","0","Soon, Finn. Soon. #fatherandson #thefinnandi #mexico #padreehijo @Finnished https://www.instagram.com/p/BQAwlhihv4-/","","@Finnished","#fatherandson #thefinnandi #mexico #padreehijo","827155392278827008","https://twitter.com/mrstevetime/status/827155392278827008"
"mrstevetime","2017-02-02 13:32","0","0","Soon, Finn. Soon. #fatherandson #thefinnandi #mexico #padreehijo @Finnished https://www.instagram.com/p/BQAtFi1B9ZD/","","@Finnished","#fatherandson #thefinnandi #mexico #padreehijo","827147698541244417","https://twitter.com/mrstevetime/status/827147698541244417"
"LegiScanMI","2017-02-02 02:56","0","1","SB0085 [NEW] Criminal procedure; records; automatic expunction of arrest records for wrongful arrest due to mista... http://bitly.com/YvMh1Z","","","","826987624875360256","https://twitter.com/LegiScanMI/status/826987624875360256"
"DetroitCP","2017-02-02 02:47","0","0","Travel agents manage panic after President Trump immigration ban http://on.freep.com/2jxEvsT","","","","826985270377644032","https://twitter.com/DetroitCP/status/826985270377644032"
"TerrysCaulking","2017-02-02 00:08","0","0","I got the bedroom tv hung on the wall , now we just need a media shelf to hang under it and run https://www.instagram.com/p/BP_RCJXDcty/","","","","826945270151835649","https://twitter.com/TerrysCaulking/status/826945270151835649"
"DetroitCP","2017-02-01 18:37","0","0","Mexican drug lord El Chapo to be in U.S. court http://detne.ws/2jVILhW","","","","826862075955679232","https://twitter.com/DetroitCP/status/826862075955679232"
"MichiganMittens","2017-02-01 16:38","0","0","WALL HANGER. MI Canvas Painting Kits are fun for everyone! (Mine's on the right)! #michigan #art https://www.instagram.com/p/BP-dj5ujsCv/","","","#michigan #art","826832081674260480","https://twitter.com/MichiganMittens/status/826832081674260480"
"sunshels","2017-02-01 05:20","0","0","On the wall at tacos!! #somethingcolourful #fmsphotoaday #fmspad @Little Mexico Family Restaurant https://www.instagram.com/p/BP9P7gsDC5n/","","@Little","#somethingcolourful #fmsphotoaday #fmspad","826661368669601792","https://twitter.com/sunshels/status/826661368669601792"
"murphalurff","2017-02-01 03:39","0","0","no wall, no ban, NO orange cheeto man (for those who cant read https://www.instagram.com/p/BP9EedAF4O_8khJsEvJ2YhLrhzWX26bmlWengA0/ ","","","","826636186689081344","https://twitter.com/murphalurff/status/826636186689081344"
"DetroitCP","2017-02-01 03:04","0","0","Tale of immigration order: Ailing mother of Henry Ford cardiologist has visa interview canceled via Jay Greene http://trib.al/dZNbeHj","","","","826627277777620992","https://twitter.com/DetroitCP/status/826627277777620992"
"DetroitCP","2017-02-01 02:46","0","0","Using LetItRip what do you think of the border ban? Is it making us safer or dividing us? We'll read your tweets t https://twitter.com/i/web/status/826619010254921728 ","","","","826622798227394569","https://twitter.com/DetroitCP/status/826622798227394569"
"OCATmsu","2017-02-01 02:03","0","0","No Ban, No Wall protest @The Rock https://www.instagram.com/p/BP85d2vApA6/","","@The","","826611973504778240","https://twitter.com/OCATmsu/status/826611973504778240"
"scottrheath","2017-02-01 00:43","0","0","#MuslimBan #immigration #Trump @Starr Commonwealth For Boys http://ln.is/www.instagram.com/p/o0wGH ","","@Starr","#MuslimBan #immigration #Trump","826591682854580224","https://twitter.com/scottrheath/status/826591682854580224"
"RaquelGarciaAnd","2017-02-01 00:07","0","1","City of Detroit's Immigration Taskforce with @raquel4detroit planning 2017 goals. https://www.instagram.com/p/BP8sG6gFpUW/","","@raquel4detroit","","826582603964805121","https://twitter.com/RaquelGarciaAnd/status/826582603964805121"
"LegiScanMI","2017-02-01 00:06","0","0","HB4133 [NEW] Criminal procedure; sentencing guidelines; statute of limitations extension for first degree crimina... http://bitly.com/Wl8b9r","","","","826582507315396608","https://twitter.com/LegiScanMI/status/826582507315396608"
"LegiScanMI","2017-01-31 22:26","0","0","HJRC [NEW] Criminal procedure; warrants; search and seizure protections; expand to include electronic communicati... http://bitly.com/WdZTQB","","","","826557343747993600","https://twitter.com/LegiScanMI/status/826557343747993600"
"Niklas_Rippon","2017-01-31 21:47","0","0","Trying to run faster but there's a wall in the way! Testing the ankle...seems to be working https://www.instagram.com/p/BP8cICKjGCW/","","","","826547453075783680","https://twitter.com/Niklas_Rippon/status/826547453075783680"
"mrstevetime","2017-01-31 18:57","0","0","Soon, Finn. Soon. #fatherandson #thefinnandi #mexico @Finnished https://www.instagram.com/p/BP8IrUah9R3/","","@Finnished","#fatherandson #thefinnandi #mexico","826504683258671104","https://twitter.com/mrstevetime/status/826504683258671104"
"INSHALLAHCLOTHI","2017-01-31 18:02","1","1","AIN'T NO WALL HERE. JUST BRIDGES! Follow me on Instagram: @TheMuaddhin #JameelSyedTravels https://www.instagram.com/p/BP8CWm6lj5P/","","@TheMuaddhin","#JameelSyedTravels","826490782035148802","https://twitter.com/INSHALLAHCLOTHI/status/826490782035148802"
"DetroitCP","2017-01-31 17:36","0","0","A small tale of immigration order: Ailing mother of Henry Ford cardiologist has visa interview canceled http://trib.al/vmUhk34","","","","826484230402084865","https://twitter.com/DetroitCP/status/826484230402084865"
"mrstevetime","2017-01-31 15:40","0","0","This was a powerhouse label of the 80's (R.E.M. , Wall of Voodoo, The Go-Gos, The Alarm, General https://www.instagram.com/p/BP7yFV-hDoj/","","","","826454999731277826","https://twitter.com/mrstevetime/status/826454999731277826"
"mrstevetime","2017-01-31 15:19","0","0","Soon, Finn. Soon. #fatherandson #thefinnandi #mexico @Finnished https://www.instagram.com/p/BP7vttMBBon/","","@Finnished","#fatherandson #thefinnandi #mexico","826449788627333121","https://twitter.com/mrstevetime/status/826449788627333121"
"mrstevetime","2017-01-31 12:52","0","0","Soon Finn, soon. #fatherandson #thefinnandi #mexico @Finnished https://www.instagram.com/p/BP7e7pWh3Dp/","","@Finnished","#fatherandson #thefinnandi #mexico","826412884125028352","https://twitter.com/mrstevetime/status/826412884125028352"
"DetroitCP","2017-01-31 12:20","0","0","Top stories: Gilbert, Gores to submit jail site plan; firms weigh immigration order; new investigation opens at DMC http://trib.al/NngmwIU","","","","826404686726991876","https://twitter.com/DetroitCP/status/826404686726991876"
"DetroitCP","2017-01-31 05:02","1","0","Dearborn, Hamtramck leaders fight back against Trump's immigration order http://dlvr.it/NFRsxM","","","","826294458597531654","https://twitter.com/DetroitCP/status/826294458597531654"
"DetroitCP","2017-01-31 02:59","0","0","President Trump fires Acting Attorney General Sally Yates in rift over immigration order http://on.freep.com/2joEoQt","","","","826263509038030848","https://twitter.com/DetroitCP/status/826263509038030848"
"StaubGreg","2017-01-31 02:40","0","0","#Mexico has $50 million to defend illegal immigrants in the US? How convoluted can this get? http://m.apnews.com/ap/db_268743/contentdetail.htm?contentguid=VPrmu8Qg ","","","#Mexico","826258877004013568","https://twitter.com/StaubGreg/status/826258877004013568"
"DetroitCP","2017-01-31 01:28","0","0","Ford takes a stand against President Trump's immigration ban http://dlvr.it/NFP9Mc","","","","826240727159934976","https://twitter.com/DetroitCP/status/826240727159934976"
"DetroitCP","2017-01-31 01:28","0","0","Trumps immigration order divides U.S. Houses Michigan Republicans. http://detne.ws/2jN7xn5","","","","826240724802768896","https://twitter.com/DetroitCP/status/826240724802768896"
"MontgomeryJones","2017-01-31 00:57","0","0","*excuse the language * ""From Palestine to Mexico, these walls have GOT to go!"" #refugeeswelcome https://www.instagram.com/p/BP6NEzcDyFX/","","","#refugeeswelcome","826232883442544640","https://twitter.com/MontgomeryJones/status/826232883442544640"
"jameelsworld","2017-01-31 00:38","1","0","NO BAN NO WALL A picture is worth more than 1000 words unless those words are these. Follow https://www.instagram.com/p/BP6K4ZsDjPJ/","","","","826228079769051137","https://twitter.com/jameelsworld/status/826228079769051137"
"DetroitCP","2017-01-31 00:19","0","1","Acting AG Sally Yates won't defend Trump immigration order http://on.freep.com/2joeWL6","","","","826223279052517376","https://twitter.com/DetroitCP/status/826223279052517376"
"StaubGreg","2017-01-31 00:06","0","0","Walsh: Note to the Biblically illiterate: there is not a single part of Christian teaching that condemns or forbids strict immigration law","","","","826220072922390528","https://twitter.com/StaubGreg/status/826220072922390528"
"ChadRoto","2017-01-30 15:53","0","0","#WaveyBeats ""That's How We Gang"" Cc: @Mr_IncredibleJ @the_desman @Highland Park, Michigan https://www.instagram.com/p/BP5O0Yijmy5/","","@Mr_IncredibleJ @the_desman @Highland","#WaveyBeats","826096011936403456","https://twitter.com/ChadRoto/status/826096011936403456"
"lavurty","2017-01-30 03:53","0","0","Congresswoman Brenda Lawrence rallies at Hamtramck City Hall. #noban #detroit #immigration https://www.instagram.com/p/BP38eXrjWdE/","","","#noban #detroit #immigration","825914904301428736","https://twitter.com/lavurty/status/825914904301428736"
"DetroitCP","2017-01-30 02:45","0","0","Thousands in Michigan protest President Trump immigration plan http://on.freep.com/2jHgYV2","","","","825897712696467456","https://twitter.com/DetroitCP/status/825897712696467456"
"DetroitCP","2017-01-30 00:42","0","0","President Trump takes to social media to respond to the airport immigration protests https://m.facebook.com/DonaldTrump/posts/10158567643610725 ","","","","825866784829890560","https://twitter.com/DetroitCP/status/825866784829890560"
"Combsthepoet","2017-01-29 23:13","0","0","No ban! No wall! #NoBanNoWall @Detroit Metro Airport (DTW) https://www.instagram.com/p/BP3cbAnhrl_/","","@Detroit","#NoBanNoWall","825844430762450946","https://twitter.com/Combsthepoet/status/825844430762450946"
"DetroitSpaces","2017-01-29 22:50","0","0","Detroit Spaces stands by asylum seekers of any faith. #immigration #nobannowall #detroit https://www.instagram.com/p/BP3ZvInjY5_/","","","#immigration #nobannowall #detroit","825838509651066885","https://twitter.com/DetroitSpaces/status/825838509651066885"
