"username","date","retweets","favorites","text","geo","mentions","hashtags","id","permalink"
"DetroitCP","2017-02-28 23:07","0","0","Former Border Patrol agent, Boy Scouts leader charged with inappropriately touching boy in Romulus http://toplocalnow.com/us/detroit/at/17 ","","","","836714425692233728","https://twitter.com/DetroitCP/status/836714425692233728"
"H2O_MaggieO","2017-02-28 18:22","0","1","Yes, be #adventures with this wall art. Perfect to #transform any #room into #underwater depth https://www.instagram.com/p/BREK4q6jH3i/","","","#adventures #transform #room #underwater","836642646886084608","https://twitter.com/H2O_MaggieO/status/836642646886084608"
"ashriger","2017-02-28 17:58","0","0","New office art! It only took 3 years to hang something on the wall https://www.instagram.com/p/BREIN4PDTbM_wmBBztwypgr1UUfSlaDeSrG_MY0/ ","","","","836636769240109056","https://twitter.com/ashriger/status/836636769240109056"
"LegiScanMI","2017-02-28 17:36","0","0","SB0200 [NEW] Criminal procedure; sentencing guidelines; sentencing guidelines for crime of assault on sports offi... http://bitly.com/WlXfbM","","","","836631170301440002","https://twitter.com/LegiScanMI/status/836631170301440002"
"discbaron","2017-02-28 02:28","0","0","Discs are getting back on the walls. Come by the shop to check out the new wall hangers going https://www.instagram.com/p/BRCdyBbB8ey/","","","","836402719371898882","https://twitter.com/discbaron/status/836402719371898882"
"Polk_World","2017-02-27 15:22","0","0","#ynot @Oakland Community College- Criminal Justice Building https://www.instagram.com/p/BRBRgM3B45YWKoU3Gd9wrO3hQlgRelQRBU57RM0/ ","","@Oakland","#ynot","836235076429979648","https://twitter.com/Polk_World/status/836235076429979648"
"DetroitCP","2017-02-26 20:57","0","0","David Corliss: New immigration rules, DeVos have consequences for business http://trib.al/6N0I5bL","","","","835956875048828928","https://twitter.com/DetroitCP/status/835956875048828928"
"GrantHDowling","2017-02-26 02:18","0","1","Building a 20 billion dollar wall is more important apparently. Flint has gone almost 3 years https://www.instagram.com/p/BQ9TBX_AzWH/","","","","835675367042125824","https://twitter.com/GrantHDowling/status/835675367042125824"
"AEtherZcythe","2017-02-26 00:41","0","0","Tofu Gang Keaw Wan, FTW! =D #NoMeatAthlete (@Lue Thai Caf in Dearborn, MI) https://www.swarmapp.com/c/iUTNxhWehxM pic.twitter.com/vRAoKRKrXl","","@Lue","#NoMeatAthlete","835650869727268864","https://twitter.com/AEtherZcythe/status/835650869727268864"
"SticcTape","2017-02-26 00:04","0","0","GV Rock wall @Gvsu Climbing Center https://www.instagram.com/p/BQ9Drk4BuMb/","","@Gvsu","","835641635350302720","https://twitter.com/SticcTape/status/835641635350302720"
"billander616","2017-02-25 22:56","0","0","On the northern border tonight @On The Border Mexican Grill & Cantina https://www.instagram.com/p/BQ878FwhM1N/","","@On","","835624608518713344","https://twitter.com/billander616/status/835624608518713344"
"hillsidefurni2r","2017-02-25 16:47","0","0","The ROYAL treatment is available at Hillside! Royal blue is HOT in velvets, textures, wall art https://www.instagram.com/p/BQ8RsGngBul/","","","","835531700511846404","https://twitter.com/hillsidefurni2r/status/835531700511846404"
"DetroitCP","2017-02-25 13:10","0","0","Time's running out to take a trip across the border to tour the Canadian Club distillery http://detne.ws/2lcTINT","","","","835477108298137601","https://twitter.com/DetroitCP/status/835477108298137601"
"SuzanneG1970","2017-02-24 23:35","0","0","When I was a teenager, I actually had this poster tapes up on my bedroom wall among many http://ln.is/www.instagram.com/p/W20j8 ","","","","835271976289730560","https://twitter.com/SuzanneG1970/status/835271976289730560"
"shaneviaene","2017-02-24 23:32","0","7","You know just leaning against a wall @Downtown Rochester https://www.instagram.com/p/BQ6bRJflJ22/","","@Downtown","","835271296485376000","https://twitter.com/shaneviaene/status/835271296485376000"
"DetroitCP","2017-02-24 22:02","0","0","Donald J. Trump's quick deportation plan may be illegal, past immigration chiefs say http://toplocalnow.com/us/detroit","","","","835248474144702464","https://twitter.com/DetroitCP/status/835248474144702464"
"shawnb52284","2017-02-24 16:57","0","1","Ahhh...nothing like a hole in the wall Chinese restaurant for lunch https://www.instagram.com/p/BQ5uAKNjfTcoBTDsZmQZkRnFZCzJwjWaKfgOn00/ ","","","","835171746521174018","https://twitter.com/shawnb52284/status/835171746521174018"
"artrapp","2017-02-24 15:59","0","0","FUSED with Steve Leary & Nikki Wall opens tonight. Aesthetically this is one of my favorite https://www.instagram.com/p/BQ5nY5zhLXe/","","","","835157208128073728","https://twitter.com/artrapp/status/835157208128073728"
"LegiScanMI","2017-02-24 02:16","0","0","SB0183 [NEW] Criminal procedure; sentencing guidelines; sentencing guidelines for failure to report certain charg... http://bitly.com/YidGo2","","","","834950014673760256","https://twitter.com/LegiScanMI/status/834950014673760256"
"davidmramseysr1","2017-02-24 00:48","0","0","[HEROIN USE,] THE PREFERRED DRUG OF ""THE WALKING DEAD"" + Addicts, addicted too [Ejected Heroin,] https://www.instagram.com/p/BQ3-gLylkwp/","","","","834927988458258433","https://twitter.com/davidmramseysr1/status/834927988458258433"
"ForteBelanger","2017-02-23 23:59","0","1","Hungry? Stop by our #Donut wall at Metro Detroit Weddings Luxury Bridal Show! pic.twitter.com/0qgXoE1iJK","","","#Donut","834915625407492096","https://twitter.com/ForteBelanger/status/834915625407492096"
"lilacpop","2017-02-23 18:50","1","0","All my frames are back on the wall at @theconserva again. No theft this time! They aren't https://www.instagram.com/p/BQ3WOOQAcxQ/","","@theconserva","","834837979055214592","https://twitter.com/lilacpop/status/834837979055214592"
"sherryhansen","2017-02-23 17:08","0","0","My first wall I helped decorate w kiddos art @Ridgeview Elementary School https://www.instagram.com/p/BQ3KeunB_qU/","","@Ridgeview","","834812159464873984","https://twitter.com/sherryhansen/status/834812159464873984"
"artrapp","2017-02-23 16:31","0","0","Listening to the #SilversunPickips and arranging the work of Nikki Wall & Steve Leary for https://www.instagram.com/p/BQ3GNu0h5ez/","","","#SilversunPickips","834802777834418176","https://twitter.com/artrapp/status/834802777834418176"
"DetroitCP","2017-02-23 12:56","0","0","Criminal ex-Detroit cops are going to prison http://on.freep.com/2lHPyzN","","","","834748691181297665","https://twitter.com/DetroitCP/status/834748691181297665"
"tkriii","2017-02-23 12:41","0","0","#tbt: Last Thursday at @urbanconsulate Parlor Talk on #immigration, #Detroit, and being a https://www.instagram.com/p/BQ2r5FYFwrh/","","@urbanconsulate","#tbt #immigration #Detroit","834744906174386176","https://twitter.com/tkriii/status/834744906174386176"
"WillieStylez","2017-02-23 03:25","0","0","#DearDiary so i tried to go to On The Border to celebrate Margarita day! Guess I should've https://www.instagram.com/p/BQ1sWKIh-7Y/","","","#DearDiary","834605158361214976","https://twitter.com/WillieStylez/status/834605158361214976"
"maiyogalife","2017-02-23 03:25","0","0","This was hanging on the wall moosejawmadness Ann Arbor... I made that in 2012 and either gave it https://www.instagram.com/p/BQ1sVSrDIVC/","","","","834605129072574464","https://twitter.com/maiyogalife/status/834605129072574464"
"DetroitCP","2017-02-23 00:49","0","0","Mexico says no to Trump's new deportation rules http://toplocalnow.com/us/detroit","","","","834565715898142720","https://twitter.com/DetroitCP/status/834565715898142720"
"bigvizar","2017-02-22 22:32","0","0","Gang Gang..... bout to ride down on these fools #shityouseeinthehood #horselife #nogasneeded I https://www.instagram.com/p/BQ1KwK1Bpv2/","","","#shityouseeinthehood #horselife #nogasneeded","834531286207246336","https://twitter.com/bigvizar/status/834531286207246336"
"peterhoneyman","2017-02-22 13:26","0","0","We took the art down for some furniture moving and now the wall looks naked. pic.twitter.com/TjOuvS1UqG","","","","834393810608140290","https://twitter.com/peterhoneyman/status/834393810608140290"
"LegiScanMI","2017-02-22 09:46","0","0","SB0044 [Engross] Criminal procedure; other; recovery of certain costs for criminal contempt prosecution or retail... http://bitly.com/XFHj2e","","","","834338471649095680","https://twitter.com/LegiScanMI/status/834338471649095680"
"BeautifulEnctr","2017-02-22 04:33","0","0","I'm at NCG Eastwood Cinemas for The Great Wall in Lansing, MI https://www.swarmapp.com/c/foNRQU575HI","","","","834259885797826560","https://twitter.com/BeautifulEnctr/status/834259885797826560"
"itsnicklavelle1","2017-02-22 02:23","2","2","Out at #MSU promo gang on deck... s/o to @msuurbandreams for allowing me to invade their https://www.instagram.com/p/BQzAeTvhuwB/","","@msuurbandreams","#MSU","834227202270965760","https://twitter.com/itsnicklavelle1/status/834227202270965760"
"scottrheath","2017-02-22 01:59","0","0","#Batman66 #Batman #DCComics @Parks Drug Store http://ln.is/www.instagram.com/p/mZZXQ ","","@Parks","#Batman66 #Batman #DCComics","834221096916418560","https://twitter.com/scottrheath/status/834221096916418560"
"rspicer1","2017-02-21 22:48","0","0","Dinner (@Border Cantina in Brighton, MI) https://www.swarmapp.com/c/iKJHjrG6YVh","","@Border","","834173027646574593","https://twitter.com/rspicer1/status/834173027646574593"
"LegiScanMI","2017-02-21 22:07","0","0","SB0171 [NEW] Criminal procedure; sentencing guidelines; sentencing guidelines for increased penalties for physici... http://bitly.com/Wjio6v","","","","834162583838027776","https://twitter.com/LegiScanMI/status/834162583838027776"
"cyborwhat","2017-02-21 18:05","0","0","Wall art, journals, acrylic blocks and art boards too http://www.redbubble.com/people/cyborwhat/shop  @ https://www.instagram.com/p/BQyHdk6BAx3/","","@","","834101833974943744","https://twitter.com/cyborwhat/status/834101833974943744"
"MilesLanham","2017-02-21 14:47","0","0","Momento wall -all salvaged from basement of Chrysler House of the past @Chrysler House https://www.instagram.com/p/BQxw0oUDo4W/","","@Chrysler","","834052048136069123","https://twitter.com/MilesLanham/status/834052048136069123"
"DetroitCP","2017-02-21 13:53","0","0","Novi eatery closes after owner pleaded guilty in immigration case; assets up for bid http://on.freep.com/2loNaeS","","","","834038385253625856","https://twitter.com/DetroitCP/status/834038385253625856"
"gaslighters2017","2017-02-21 10:14","0","0","@SpeakerRyan If you deport immigrants who pay taxes, cut taxes for rich & corp, then whose taxes go up to pay for wall & health care? #unfit","","@SpeakerRyan","#unfit","833983149973598208","https://twitter.com/gaslighters2017/status/833983149973598208"
"josssmith1","2017-02-20 22:00","0","0","Went to see the movie great wall and then to eat with his mom and https://www.instagram.com/p/BQv9gC6Dk3gSkwDQmBcT2wzrLzXD_h6mUFCIPA0/ ","","","","833798453729824768","https://twitter.com/josssmith1/status/833798453729824768"
"Rickdotcash","2017-02-20 20:28","0","0","When you get drug out to the mall @Twelve Oaks Mall https://www.instagram.com/p/BQvzBapAOvPkyJL8vFcRJGYJjygGeObNzusFzI0/ ","","@Twelve","","833775410257227776","https://twitter.com/Rickdotcash/status/833775410257227776"
"DetroitCP","2017-02-20 15:36","0","1","Lego Batman tops the box office again, conquering The Great Wall. http://toplocalnow.com/us/detroit","","","","833701986188947457","https://twitter.com/DetroitCP/status/833701986188947457"
"CurtisWithaC","2017-02-20 13:07","0","0","Because it's not officially an #office until you have real #art on the wall, right? This https://www.instagram.com/p/BQvAjHNlwUw/","","","#office #art","833664423617245185","https://twitter.com/CurtisWithaC/status/833664423617245185"
"shootdopespot","2017-02-20 12:29","2","1","Shop http://Shootdopespot.com for that art dope !!! #artist #newart #zine #artblog #drug https://www.instagram.com/p/BQu8LYJAPAA/","","","#artist #newart #zine #artblog #drug","833654807730733056","https://twitter.com/shootdopespot/status/833654807730733056"
"LuchyTheReaper","2017-02-19 23:20","0","0","#gang @Belle Isle Park https://www.instagram.com/p/BQth3BWBNTk/","","@Belle","#gang","833456214298157056","https://twitter.com/LuchyTheReaper/status/833456214298157056"
"KentonTBriggs","2017-02-19 21:26","0","0","This Ice Rink wall is the only wall I will ever hug @Northern Lights Arena https://www.instagram.com/p/BQtU5QhA764/","","@Northern","","833427686701821957","https://twitter.com/KentonTBriggs/status/833427686701821957"
"rodney7hall","2017-02-19 18:01","0","3","They gang, we gang...but they are not the same @University of Michigan https://www.instagram.com/p/BQs9ZLxD5Tu/","","@University","","833376015074328576","https://twitter.com/rodney7hall/status/833376015074328576"
"DetroitCP","2017-02-19 14:58","1","0","Today: 21 executives from Michigan join Lt. Gov. Calley on trade mission in Mexico http://toplocalnow.com/us/detroit","","","","833329820507385856","https://twitter.com/DetroitCP/status/833329820507385856"
"DetroitCP","2017-02-19 14:58","0","0","Trump wants a wall. Border experts want a fence http://toplocalnow.com/us/detroit","","","","833329813049847808","https://twitter.com/DetroitCP/status/833329813049847808"
"DetroitCP","2017-02-19 13:50","0","0","Immigration is our wake-up call http://on.freep.com/2kLGyFv","","","","833312699383631872","https://twitter.com/DetroitCP/status/833312699383631872"
"Jodi_Lange","2017-02-19 01:43","0","1","The volleyball gang - fun and food... now up early tomorrow and go at it again! (at @RenosWest in Lansing, MI) https://www.swarmapp.com/c/auBV9dbznfB","","@RenosWest","","833129916715634688","https://twitter.com/Jodi_Lange/status/833129916715634688"
"iAmJayAre","2017-02-18 21:52","0","0","#NowWatching The Great Wall Rating after movie at jayaresmovies #TheGreatWall @Emagine Theatres https://www.instagram.com/p/BQqzEwCADZT/","","@Emagine","#NowWatching #TheGreatWall","833071838364389376","https://twitter.com/iAmJayAre/status/833071838364389376"
"DJTwist1000","2017-02-18 15:46","0","0","Last nite shook some of the paintings of the wall at the #Detroit Institute of Arts  https://www.instagram.com/p/BQqJMKXje13/","","","#Detroit","832979734724222977","https://twitter.com/DJTwist1000/status/832979734724222977"
"peterhoneyman","2017-02-18 14:57","0","1","I found this print that I dont recognize taped to the wall behind a shelf of books. \_()_/ pic.twitter.com/k71bbwYzs1","","","","832967284742307841","https://twitter.com/peterhoneyman/status/832967284742307841"
"DetroitCP","2017-02-18 13:59","0","0","US Marshals search for career criminal Anthony Funderburg, the newest Detroit's Most Wanted. http://toplocalnow.com/us/detroit","","","","832952702732636160","https://twitter.com/DetroitCP/status/832952702732636160"
"photoTJ","2017-02-18 13:09","0","0","Wall to Wall @The Pyramid Scheme https://www.instagram.com/p/BQp3LsuDOSO/","","@The","","832940138699296769","https://twitter.com/photoTJ/status/832940138699296769"
"gaslighters2017","2017-02-18 11:50","0","0","@SpeakerRyan Your gonna cut taxes for the rich and have middle class pay for your 20mill wall, guess it wont be Mexico they told DJT NO WAY!","","@SpeakerRyan","","832920168871366657","https://twitter.com/gaslighters2017/status/832920168871366657"
"Buddhafist69","2017-02-18 05:45","0","0","Making America Great Again @Immigration Legal Services https://www.instagram.com/p/BQpESs1l8-3/","","@Immigration","","832828244785262592","https://twitter.com/Buddhafist69/status/832828244785262592"
"DetroitCP","2017-02-18 00:54","0","0","Wayne County prosecutors under fire for supporting dirty cops in drug conviction http://toplocalnow.com/us/detroit","","","","832755023977205764","https://twitter.com/DetroitCP/status/832755023977205764"
"TourBusDiaries","2017-02-17 22:26","0","0","Redeemed ""America's Most Wanted"" drug kingpin Brian Maurice Brown is now a respected music https://www.instagram.com/p/BQoSDysFtVr/","","","","832717777051987969","https://twitter.com/TourBusDiaries/status/832717777051987969"
"DetroitCP","2017-02-17 19:41","0","0","Despite Trump, Ford moves ahead with plans for Mexico plants http://toplocalnow.com/us/detroit","","","","832676259159158785","https://twitter.com/DetroitCP/status/832676259159158785"
"StudioBold","2017-02-17 19:26","0","1","Best quote I've heard in a long time: @abstractsunday ""...the gateway drug is not creating art, https://www.instagram.com/p/BQn9h4XDiSB/","","@abstractsunday","","832672620965302274","https://twitter.com/StudioBold/status/832672620965302274"
"urbaneyephoto","2017-02-17 18:23","0","0","'The Wall' (photo by Terrence Jennings/terrencejennings.com) #detroit #imagesmatter https://www.instagram.com/p/BQn2WanDopo/","","","#detroit #imagesmatter","832656835077406720","https://twitter.com/urbaneyephoto/status/832656835077406720"
"KristinGPhoto","2017-02-17 16:30","0","0","This beaut just arrived and now graces our great room wall. Now to style some shelves. Anddd https://www.instagram.com/p/BQnpUjfhBmk/","","","","832628179298693123","https://twitter.com/KristinGPhoto/status/832628179298693123"
"mrstevetime","2017-02-17 10:37","0","0","Out of here. #fatherandson #thefinnandi #mexico #padreehijo #finnsfavoritecolorisgreen https://www.instagram.com/p/BQnBAJyDaNt/","","","#fatherandson #thefinnandi #mexico #padreehijo #finnsfavoritecolorisgreen","832539516254744578","https://twitter.com/mrstevetime/status/832539516254744578"
"DetroitCP","2017-02-17 09:50","0","0","Retail execs express concerns about border tax http://toplocalnow.com/us/detroit","","","","832527522327732224","https://twitter.com/DetroitCP/status/832527522327732224"
"westcott_trevor","2017-02-17 02:55","0","1","@Eminem you could have retired as a #GOAT after drug ballad and elevator thanks for giving us so much more","","@Eminem","#GOAT","832423278639726592","https://twitter.com/westcott_trevor/status/832423278639726592"
"LegiScanMI","2017-02-16 23:16","0","0","HB4245 [NEW] Criminal procedure; sentencing guidelines; sentencing guidelines for violation of Michigan fireworks... http://bitly.com/YjCThI","","","","832368130286637056","https://twitter.com/LegiScanMI/status/832368130286637056"
"LGeventdesign","2017-02-16 19:30","0","0","Who needs to build a backdrop when you've got a living plant wall ready for the taking? We https://www.instagram.com/p/BQlZKXDArID/","","","","832311173290799104","https://twitter.com/LGeventdesign/status/832311173290799104"
"modymalay","2017-02-16 14:51","0","0","This level of stupidity should be criminal https://twitter.com/realDonaldTrump/status/832238070460186625 ","","","","832241022373605378","https://twitter.com/modymalay/status/832241022373605378"
"scottrheath","2017-02-16 14:24","0","0","#StarWars @Parks Drug Store http://ln.is/www.instagram.com/p/wK74L ","","@Parks","#StarWars","832234273080016896","https://twitter.com/scottrheath/status/832234273080016896"
"mrstevetime","2017-02-16 04:48","0","0","Soon, Finn. Soon. #fatherandson #thefinnandi #mexico #padreehijo #kindereggs @Finnished https://www.instagram.com/p/BQj0NKWhzyV/","","@Finnished","#fatherandson #thefinnandi #mexico #padreehijo #kindereggs","832089166309515264","https://twitter.com/mrstevetime/status/832089166309515264"
"LegiScanMI","2017-02-16 04:37","0","0","HB4219 [NEW] Criminal procedure; sentencing; deferral and dismissal eligibility for victims of human trafficking;... http://bitly.com/YDlLne","","","","832086423830458370","https://twitter.com/LegiScanMI/status/832086423830458370"
"LegiScanMI","2017-02-16 02:16","0","0","HB4211 [NEW] Criminal procedure; evidence; testimony of expert witnesses regarding behavior pattern of human traf... http://bitly.com/YSrbuN","","","","832050918195621897","https://twitter.com/LegiScanMI/status/832050918195621897"
"HiddenLLC","2017-02-15 20:25","0","0","LG 50-inch Smart TV comes with wall mount remote AV cable and HDMI cord $300. $50 melting and https://www.instagram.com/p/BQi6qEZg3ZL/","","","","831962617132568577","https://twitter.com/HiddenLLC/status/831962617132568577"
"daniel_graves","2017-02-15 19:36","1","10","C'mon Canada! Let us in! You know you wanna! #IndustrialPopTour @Canada/US Border https://www.instagram.com/p/BQi1BpsjRoG/","","@Canada","#IndustrialPopTour","831950233424769024","https://twitter.com/daniel_graves/status/831950233424769024"
"LespritAcademy","2017-02-15 18:48","0","0","New Selfie Wall in Royal Oak       #lespritacademy #royaloak #downtownroyaloak https://www.instagram.com/p/BQivkHuBTEo/","","","#lespritacademy #royaloak #downtownroyaloak","831938223005765632","https://twitter.com/LespritAcademy/status/831938223005765632"
"pfanderson","2017-02-15 17:59","0","0","Noticing that the new ""art"" juts out of the wall at exactly the height of my temple.... https://www.swarmapp.com/c/8tQwwzdlzkR pic.twitter.com/UBODYIL78B","","","","831926027303735299","https://twitter.com/pfanderson/status/831926027303735299"
"quaranTinaTurnr","2017-02-15 15:53","0","0","Lead singer/dancer Balla Reena leads L'Go Gang in their hit ""Birds of a Feather a Rock Together"" https://www.instagram.com/p/BQibgkOFGuN/","","","","831894125507182593","https://twitter.com/quaranTinaTurnr/status/831894125507182593"
"mrstevetime","2017-02-15 14:58","0","0","I love getting these out. #fatherandson #thefinnandi #mexico #padreehijo #stampit https://www.instagram.com/p/BQiVND0hkYb/","","","#fatherandson #thefinnandi #mexico #padreehijo #stampit","831880254964719616","https://twitter.com/mrstevetime/status/831880254964719616"
"RoadZombie13","2017-02-15 14:46","0","2","I'm at Canada & United States Border in Point Edward, Ontario https://www.swarmapp.com/c/axu0nrEyPM0","","","","831877459150766084","https://twitter.com/RoadZombie13/status/831877459150766084"
"yogabba724","2017-02-15 02:15","0","0","My Valentine @Genitti's Hole in the Wall https://www.instagram.com/p/BQg96Y9jSxhwPmnFodGBm4Bll9h82cBfHRHyTM0/ ","","@Genitti","","831688301396500480","https://twitter.com/yogabba724/status/831688301396500480"
"JoeSantos615","2017-02-15 00:26","0","1","Jonah's back between the pipes! He's building a wall around the net and making all that shoot https://www.instagram.com/p/BQgxeOVBT1S/","","","","831660944778424320","https://twitter.com/JoeSantos615/status/831660944778424320"
"DetroitCP","2017-02-14 17:25","0","0","First Stanley Cup for the Red Wings under Mike Ilitch. Name displayed first on wall right outside the locker room http://toplocalnow.com/us/detroit","","","","831554869567721473","https://twitter.com/DetroitCP/status/831554869567721473"
"DetroitCP","2017-02-14 12:39","0","0","Drug dealer known as White Boy Rick takes a step toward parole today http://toplocalnow.com/us/detroit","","","","831482888851853312","https://twitter.com/DetroitCP/status/831482888851853312"
"mrstevetime","2017-02-13 12:33","0","0","Soon, Finn. Soon. #fatherandson #thefinnandi #mexico #padreehijo #littleluchador @Finnished https://www.instagram.com/p/BQc7EyJh5BU/","","@Finnished","#fatherandson #thefinnandi #mexico #padreehijo #littleluchador","831119106292097025","https://twitter.com/mrstevetime/status/831119106292097025"
"6mile_Kellz","2017-02-13 01:16","0","0","When your bacc was against the wall remember where could you go, https://www.instagram.com/p/BQbtmPSjB-e6t98OPaUhih6XwGZWr7K0f4TAZc0/ ","","","","830948735383437313","https://twitter.com/6mile_Kellz/status/830948735383437313"
"freshnuttz","2017-02-13 00:52","0","0","Art gang nigga camera snappin","","","","830942628925554688","https://twitter.com/freshnuttz/status/830942628925554688"
"sandeepshabd","2017-02-12 23:24","0","0","Wall painting at a #mexican #restaurant @Los Tres Amigos Plymouth https://www.instagram.com/p/BQbgym4gera/","","@Los","#mexican #restaurant","830920571487649794","https://twitter.com/sandeepshabd/status/830920571487649794"
"andy_pandy17","2017-02-12 23:16","0","0","Gonna be weird when the gang splits up after this semester @University of Michigan https://www.instagram.com/p/BQbf0eeA07V/","","@University","","830918436767354880","https://twitter.com/andy_pandy17/status/830918436767354880"
"DMB_Spartan","2017-02-12 21:22","0","0","The drug war and becoming tax collectors are the real reason. Not even half their jobs anymore involve protecting and serving. @S2Scottiehttps://twitter.com/FoxNews/status/830864554515169282 ","","@S2Scottiehttps","","830889797350780931","https://twitter.com/DMB_Spartan/status/830889797350780931"
"thatgirlSam_","2017-02-12 20:06","0","0","the gang gets weird @Detroit, Michigan https://www.instagram.com/p/BQbKKsFBtyoKSD77556pGvOnC6z0CHSXnAdig80/ ","","@Detroit","","830870821287505920","https://twitter.com/thatgirlSam_/status/830870821287505920"
"maryjofosho","2017-02-12 17:16","0","0","Some cool wall in Michigan. @Ann Arbor, Michigan https://www.instagram.com/p/BQa2qwfhOE5/","","@Ann","","830827945061085186","https://twitter.com/maryjofosho/status/830827945061085186"
"DetroitCP","2017-02-12 15:02","0","0","Here's what to do if immigration officers come knocking at your door. http://on.freep.com/2lEECAo","","","","830794256113557504","https://twitter.com/DetroitCP/status/830794256113557504"
"DetroitCP","2017-02-12 13:35","0","0","Brian Dickerson: The welcome mat vs. the wall http://on.freep.com/2kj7mwN","","","","830772215599681537","https://twitter.com/DetroitCP/status/830772215599681537"
"mrstevetime","2017-02-12 13:24","0","0","Me: ""You know Finn, I started growing my beard in Mexico a year ago."" Finn: ""No dad. No."" https://www.instagram.com/p/BQacIOZBakv/","","","","830769580091904000","https://twitter.com/mrstevetime/status/830769580091904000"
"Chrispy_FaFu","2017-02-12 01:18","0","0","Whatchu know. #straycats @Old Mexico Restaurant https://www.instagram.com/p/BQZJAjug2d2/","","@Old","#straycats","830586799344984068","https://twitter.com/Chrispy_FaFu/status/830586799344984068"
