"username","date","retweets","favorites","text","geo","mentions","hashtags","id","permalink"
"adaminaction","2017-01-30 05:17","0","0","A sloping rock wall down into the middle Deschutes River, a relatively wilderness class 3-4 run https://www.instagram.com/p/BP4GFrXlZca/","","","","825936044315070464","https://twitter.com/adaminaction/status/825936044315070464"
"WineJulia","2017-01-28 06:55","0","1","Literally, right beyond this wall is the real train depot. oes_restaurant has retired dining https://www.instagram.com/p/BPzHsz-B7Id/","","","","825235900237967360","https://twitter.com/WineJulia/status/825235900237967360"
"littlebayroot","2017-01-28 02:58","0","0","With all this talk of a Wall, we brought back our Word Tree Baja hoodie. https://www.instagram.com/p/BPysh6kgaaZ/","","","","825176146362900480","https://twitter.com/littlebayroot/status/825176146362900480"
"SkyVipGrady","2017-01-25 23:25","0","0","I'm at Oregon/Washington Border in Portland/Vancouver, OR https://www.swarmapp.com/c/gXS9vMb3yMu","","","","824397922066374656","https://twitter.com/SkyVipGrady/status/824397922066374656"
"kickalert","2017-01-25 07:16","0","2","@mikebhendrix Rome Fortune with GANG$IGN$and DUBBLIFE at @holocene (Feb 11, 2017) http://songkick.rocks/2jofkaK pic.twitter.com/3IFjaCmppc","","@mikebhendrix @holocene","","824154069010878464","https://twitter.com/kickalert/status/824154069010878464"
"Glassyjoint","2017-01-22 01:13","0","0","Spectrum Custom Glass & James Gang crushin' it like Red Pepper in Lebanon Oregon! https://www.instagram.com/p/BPjDtV7lv-F/","","","","822975343053197312","https://twitter.com/Glassyjoint/status/822975343053197312"
"toddhiestand","2017-01-21 21:19","0","0","A few more pics of Sammy Sosa, our Australian Cattle Dog / Border Collie mix. So far, she's https://www.instagram.com/p/BPio-c7BHYq/","","","","822916532002897920","https://twitter.com/toddhiestand/status/822916532002897920"
"ThatTallGuyyEli","2017-01-21 19:01","0","0","My Kurt Cobain drawings hung up on the wall #kurtcobain @Gresham - Northwest, Gresham, Oregon https://www.instagram.com/p/BPiZOnOhiZb/","","@Gresham","#kurtcobain","822881906744143872","https://twitter.com/ThatTallGuyyEli/status/822881906744143872"
"mysticmayhem17","2017-01-21 18:54","0","0","About to start! We. Make. America! @Oregon State Capitol https://www.instagram.com/p/BPiYYTeB-xHftrCIqvgxkjbQYX9IP-L-V8U-Og0/ ","","@Oregon","","822880074349195264","https://twitter.com/mysticmayhem17/status/822880074349195264"
"solsticehome","2017-01-21 00:41","0","0","Channeling spring with a few sweet baskets.square basket on wall 10"" sq. $22. Plant basket https://www.instagram.com/p/BPgbVrEBx2d/","","","","822605069308821504","https://twitter.com/solsticehome/status/822605069308821504"
